Crypto,Subreddit,Title,Content,Score,Created_At,Comments
ETH,cryptocurrency,"Ethereum under governance attack: A selfish group of miners have created EGL token that seeks to artificially control the gas limit, against network’s design. Over 20% of the hashpower has signed up for this already","A token claiming to assist in ethereum governance has been created (EGL token - Ethereum Gas Limit) and around 20% of the hash power of ETH has already signed up for this and are collecting these tokens, which threatens to disrupt the governance process of Ethereum and manipulate gas limit in favour of miners.   In regular process, the gas limit used on the network is voted on by miners in coordination w/ core devs. The miners can vote on the protocol’s gas limit. In regular course, the miners are incentivised to act in the best interests of the protocol and retain this governance. However, with proof of stake merge cutting miners out, they are now acting in selfish interest.   However, EGL now seeks to bribe miners to tokenize & sell this control to the market instead, ignoring due process. Such a proposal will never pass EIP process, but now due to greedy miners this attempt at power grab is being played out.   Miners are taking this step because of the upcoming proof of stake merge, that threatens to cut miners out of the picture. Hence, they are attempting to divest their control on the network in this fashion, by selling their governance out in collaboration with some rogue VC funds, and trying to seek rent on the governance process.   The Ethereum team must make it clear that they don’t endorse this EGL project. People buying this in the market are just helping rouge miners cash out  and providing liquidity to bad actors.",1485,2021-08-21 12:35:19,1141
ETH,cryptocurrency,"For the first time in my life I could purchase Bitcoin, Ethereum, Litecoin and Monero from a crypto ATM here in Geneva (Switzerland). Mass adoption is really starting!","For the time first time ever I used a crypto ATM here in Geneva - although hidden in the manor store, four coins were available for purchase with a 1000 chf limit per person per day. Cash only, you are given a qr code with a public key to send and receive the amount your purchased. The machine was operated by Bity, and for any purchase of Bitcoin I was asked a fee of 4 chf.  This is truly astonishing considering that 10 years ago buying Bitcoin was almost like using limewire. Gradually, I hope to see more ATMs pop up and enable people to invest without having to disclose all your personal information on sites like coinbase or binance.  Mass adoption is really around the corner, and with more and more people jumping on board, I do believe crypto ATM will be a bridge of accessibility. When crypto will become a useable currency in major stores these will become essential!  Edit: Thank you all for taking the time to leave a comment and for the awards and upvotes!  I must clarify that the reason I made this post was literally because I think it’s useful for all of us to hear, discuss and argue about crypto ATMs and debate on accessibility of crypto to the public and investors, and also to help fellow noobs (like myself) and non-noobs discover something we didn’t know much about until now. I literally found out about this ATM not even two days ago.... Also, how freaking cool is it that you can buy crypto from an ATM?! Come on, that’s just awesome (with pros and cons I hear you).   Edit2: For all those that are upset I didn’t cross post from the other subreddits I posted at - my bad, didn’t know I could do that!",2984,2021-06-15 12:00:43,354
ETH,cryptocurrency,"The best thing about Ethereum going PoS is that it will be 100% independent of whatever happens in China. Ban, Miner ban, Flood, Miner un-ban, nothing will hamper proof of stake.",,2677,2021-05-23 17:58:08,401
ETH,cryptocurrency,"Loopring (LRC), the solution for Ethereum scalability",,2064,2021-12-04 18:53:40,419
ETH,cryptocurrency,Reddit announces partnership with the Ethereum Foundation,,2525,2021-01-27 19:33:44,451
ETH,cryptocurrency,"Ethereum jumps 13% ahead of ‘merge’ upgrade, whales stock up",,1731,2022-07-16 13:32:34,366
ETH,cryptocurrency,"The SEC closes investigation into Ethereum 2.0, no securities charges against ETH: Consensys",,717,2024-06-19 05:08:05,190
ETH,cryptocurrency,"Kim Kardashian, Floyd Mayweather, Paul Pierce Sued Over Ethereum Max Promotion",,1939,2022-01-10 20:25:47,413
ETH,cryptocurrency,"Early Ethereum investor sells 350 ETH after 8.5 years, 446x gains realized",,997,2024-09-16 05:08:10,94
ETH,cryptocurrency,"Bill To Make Bitcoin, Ethereum, Litecoin and Bitcoin Cash Means of Payments for State Agencies Hits New York.",,1556,2023-02-02 14:57:23,287
ETH,cryptocurrency,"The longer I'm in crypto, the more I lean toward Ethereum Maximalism","In 4 days time the Ropsten test merge will happen, turning the Ropsten testnet from POW to Proof of stake.  On the 30th june, the difficulty bomb will go off, gradually increasing the difficulty for miners to mine blocks.  The data can be found here:   Http://wenmerge.com  And in an as yet unspecified date in august, the real main net merge will happen.  So why am I so bullish about the merge?  Its largely Eth moving instantly from 3.3% inflation to -0.7% inflation. But it's also these.   1. 99% reduction in energy cost per Tx.  2. 90% issuance reduction.  12500 eth a day to 1250.  3. Miner sell pressure drops from 14,000 eth a day to 0.  4. More eth locked in the staking contract for 6 months after the merge .  5. Deflationary asset.  More eth burned than produced if gwei >20gwei.    Number 3 is I think the most important. While it wont drop to exactly 0 on the first night, removing $30 million of sell pressure per day will have a massive effect.  The market would need to refind this pressure just to stop the price going up. (Its guaranteed profit). It wont find this sell pressure.    There won't be a 'massive selloff' on merge night.  All eth remains locked into the contract until the next update.  After that, there is a queued release.   I believe that both Bitcoin and Ethereum are stores of value,  but Ethereum is currently also the worlds largest and most secure crypto network.  It is the foundation of web3.    As a final note, it took 19 months to get 12.6 million into the deposit contract.   In the last 2 months alone,  2.6 million of that amount was deposited.    As a final final note, I'd like to thank Do Kwon for causing the luna crash and allowing us to buy Eth this cheap, this close to the merge.  And also removing luna from the market and allowing Ethereum more room to grow in MC.  You're a bastard, make no mistake; but you're a magnificent one.  Edit:  Thank you for all of your lovely comments.",1155,2022-06-05 03:09:26,761
ETH,cryptocurrency,"Ethereum Is Burning $10,000 Every Minute After EIP-1559 Upgrade",,1746,2021-08-05 15:56:02,541
ETH,cryptocurrency,"Ethereum Could Skyrocket Over 860% in 2022, Predicts Top Crypto Analyst | The Daily Hodl",,1522,2021-07-21 21:34:47,729
ETH,cryptocurrency,"Ethereum finally starts to switch to Proof of Stake. What do you think, what coin will abandoned miners find instead?","As recently posted on this subreddit, [Ethereum has just launched first testnet for PoS update](https://np.reddit.com/r/CryptoCurrency/comments/rkukit/ethereum_launches_firstever_public_testnet_for/). When the update goes completely live, the miners will become literally obsolete - no compromises.  So now we have two warriants:  * Miners resigned!!! Everybody sells graphic cards to public! Gamers happy ~~as only Bitcoin farms remain!~~  or  * Miners switch to other remaining PoW coin, and surrounding press is making it go crazy.  While lots of everyday people would like the first to happen, I think that the latter is way way more realistic.  But what coin it could be? ~~Will miners switch to Bitcoin and concrete it even more? Or~~ will they go for Ergo, that is slowly setting down and is going to make payments less while reducing the possibility of mega-mines? Then we have Litecoin, Monero and after it... a huge list of lesser known coins.  What is your take on this situation? I'd personally love to see Ergo skyrocket, but it's only my early investor's hopium, ~~realistically I think that everybody will just switch to Bitcoin.~~  **EDIT: Someone just told me the difference between Bitcoin and GPU mining, so I edited the post :)**",1153,2021-12-21 13:06:12,1079
ETH,cryptocurrency,Apple's Steve Wozniak Dumps Facebook And Thinks Ethereum Could Be The New Apple,,4787,2018-05-18 12:06:24,381
ETH,cryptocurrency,"Fidelity Suddenly Issues Huge $1.5 Trillion Prediction As ‘Parabolic’ Bitcoin Price Surge Boosts Ethereum, XRP And Crypto",,781,2024-02-27 01:01:12,228
ETH,cryptocurrency,Ethereum’s “Merge” is about to put every ether miner out of work,,1123,2022-08-20 22:58:12,577
ETH,cryptocurrency,Jaredfromsubway is the biggest gas spender on Ethereum with over $70M spent,"I’m sure all of you have heard about Jaredfromsubway.eth and his infamous MEV bot which runs sandwich attacks.   He basically runs an MEV bot which runs 2 transactions before and after the original swap transaction of an unsuspecting user and end up making profit from the same by manipulating the price of the asset being swapped.   As per the analysis on dune by hildobby https://dune.com/hildobby/Gas?Timeframe=All+Time  He has now spent the most amount of gas in terms of ETH with over 37k ETH or $70M spent which puts his wallet ahead of the biggest exchanges like Binance, Coinbase, etc  If we look at it from a percentage perspective, he has spent more than 5% of the total gas being spent in the last 6 months.  Can you guess how much profit he would have made by spending almost $70M in gas?  Not-So-Fun Fact: Jaredfromsubway.eth gets his name from the former spokesperson for the fast food chain Subway who was convicted for child pornography and pedophilia and was sentenced to 15 years in prison back in 2015.",611,2023-09-09 14:14:21,594
ETH,cryptocurrency,"Rich Dad Poor Dad Author Issues Stark Warning, Tells Investors To Grab Bitcoin and Ethereum Before ‘Giant Stock Market Crash’",,1346,2021-09-27 09:20:35,750
ETH,cryptocurrency,"The Merge Testing Is 90% Complete, Says Ethereum’s Vitalik Buterin",,1322,2022-07-22 12:27:18,426
ETH,cryptocurrency,Is Ethereum Still Worth the Investment? A deeper look.,"&#x200B;  ### Ethereum  2021 was a fantastic year for crypto, in particular Ethereum. Ethereum reigns as **the second-largest blockchain** despite the slew of competition from Binance SC, Solana, Avalanche. But it remains far ahead showcased by various metrics, and there are no signs of slowing down.  #### Total Value Locked  [*How to use TVL metrics*](https://medium.com/coinmonks/use-tvl-to-spot-the-next-hot-coin-crypto-market-update-12-28-dbae6020294a)  Ethereum ended 2021 with a Total Value Locked (TVL) of $153 billion and contains nearly 60% of TVL in crypto. Its nearest competitor Terra (LUNA) TVL, sits at $13.3b with 7% of the market. Despite the hype following emerging L1s they remain far from the king.  &#x200B;  https://preview.redd.it/blud071uo4f81.png?width=800&format=png&auto=webp&s=0e54dd093d848d7b55536a6f9daa638799116601     #### Revenue  Ethereum showcased impressive revenue in 2021 totaling $10.9b. The nearest L1 was BSC, which edged on $1.0b of revenue. There are four projects on Ethereum that post larger revenue than BSC. (Filecoin, Axie, Opensea, Uniswap)  Opensea, an NFT marketplace on Ethereum, saw a revenue of $1.5b in 2021 with the emergence of NFTs.  &#x200B;  &#x200B;  https://preview.redd.it/kkgktdovo4f81.png?width=800&format=png&auto=webp&s=0fc1a89d4b528841edba4038faf655798a8dc158     #### Layer 2s on Ethereum  Layer 2 protocols are taking traction, benefitting from Ethereum’s **reliability and security**. In the future, Ethereum may be a consensus layer for an extensive array of layer 2s that inherit low gas fees and fast TPS speeds.  Some top names are Polygon (MATIC), Optimism, Arbitrum, Loopring (LRC), and ZkSync.  #### Creator Earnings  Typically, creators on centralized networks like YouTube, Spotify, Etsy, and OnlyFans, only capture a portion of the revenue they create. As the creator economy on Ethereum begins to evolve, many creators will start to see the benefits of capturing a larger percentage of value utilizing a decentralized network. NFTs for artists is a prime example. Ethereum, as a whole, competes with prominent names in creator economies.  &#x200B;  https://preview.redd.it/bj90vk8xo4f81.png?width=800&format=png&auto=webp&s=14b7da6a2f6ce455e71cba02cdddbd46535a31c1     #### Eth Burning and Deflationary Pressures  EIP — 1559 upgrade has been burned 1.7 million ETH  at a valuation of $4.6 billion since early Aug 2021. Before EIP-1559, all ETH would remain on the network. Now, supply decreases with every transaction.  &#x200B;  https://preview.redd.it/p137lguyo4f81.png?width=800&format=png&auto=webp&s=177950e27231b4b6e071da3636bd78f1faa1757a   Even though Ethereum remains inflationary, the increasing demand sees days of negative issuance. With ETH continuously being locked away, bought for speculation, and utilized for gas fees, Ethereum’s deflationary pressures will exceed new supply.   &#x200B;  https://preview.redd.it/b9548ab0p4f81.png?width=800&format=png&auto=webp&s=33d952ac0f6b1adc67a4015195e051ad01038bfd  &#x200B;     #### Conclusion  Ethereum remains far ahead of its competition in almost all metrics. [Moreover, it attracted the highest number of developers in 2021](https://medium.com/coinmonks/electric-capital-developer-report-recap-where-are-the-crypto-developers-going-and-why-its-3855aa5dd1d8) that continue to build the ecosystem.  There are a few negatives for Ethereum, no doubt. Ethereum is slow, and gas fees are incredibly high. In addition, environmental mandates are beginning to add pressure to the “proof of work” consensus. But, Ethereum contains scheduled upgrades that will improve speed, lower gas fees, and see a switch to an eco-friendly “proof of stake.” Ethereum Consensus Network (formerly Eth 2.0) will be near completion in approximately one year.  So, what are we left with?  * The largest and fastest-growing ecosystem in crypto *  Significant deflationary pressures * The emergence of Layer 2 options  *  Dwindling supply *  Hammered down ETH prices *  Upcoming improvement upgrades to the network *  The emergence of creator economy (NFTS, DAOs, music, writers, games)  [It’s no wonder Cathie Wood and her team of quants forecast an ETH price of 180k by 2030](https://www.nasdaq.com/articles/cathie-wood%3A-ethereum-will-reach-%2420-trillion-market-cap-by-2030).  2022 will be an important year for [Ethereum upgrades](https://etherworld.co/2021/12/02/ethereums-latest-roadmap/). In the past, upgrades are often delayed and I expect no different this time. But, the process seldom detriments the network. So…  At its current price of $2680, Ethereum could be a complete steal, **and far as the risk/reward ratio, it remains one of the best crypto investments**.  &#x200B;     ### Gabi  *Follow me on*  [*Medium*](https://medium.com/@TraderGabi) *or subscribe to this FREE daily newsletter on* [*Substack*](https://tradergabi.substack.com/) *to receive it first!*",1203,2022-02-01 01:59:51,709
ETH,cryptocurrency,2 whales dump $35.7m in ETH after the Ethereum Foundation and Vitalik Buterin sell,,922,2023-05-09 06:59:36,385
ETH,cryptocurrency,Ethereum Creator Vitalik Calls Bitcoin Maximalist Michael Saylor a ‘Total Clown’,,1137,2022-07-31 10:59:43,512
ETH,cryptocurrency,"Ethereum hits $3.2K, surpassing Bank of America market cap",,739,2024-11-10 15:25:51,82
ETH,cryptocurrency,Elon Musk tweets 'Ethereum',,2907,2019-04-30 01:20:19,449
