Crypto,Subreddit,Title,Content,Score,Created_At,Comments
ETH,cryptocurrency,The Ethereum triple halving and why ETH will easily overtake BTC in marketcap,"&#x200B;  So, why do I make such a confident claim as to why Ethereum will easily surpass BTC as the largest cryptocurrency by almost every metric including market cap? Simply put, its because the Ethereum selling pressure is going to reduce by as much as 90% – the equivalent of three Bitcoin halvenings in the span of 12 months. ETH will experience what is known as a triple halving, yes you read that right, a triple halving. To understand the triple halving of ETH we need to first understand what the BTC halving is:  * A Bitcoin halving event is when the reward for mining bitcoin transactions is cut in half. * This event also cuts in half Bitcoin's inflation rate and the rate at which new bitcoins enter circulation. * It is widely thought that all previous halvenings are closely correlated to the initiation of bull market cycles leading to much higher prices than previous cycles.  &#x200B;  https://preview.redd.it/ya4ccg2yuqh71.png?width=1070&format=png&auto=webp&s=cb05471edf3ba58045ef2534d2b377c4f5413c91  Ethereum will undergo a triple halving, or in other words, 50% \* 50% \* 50% = 12.5%, i.e. a 87.5% reduction in issuance which is the equivalent to 3 consecutive Bitcoin halving events. The upcoming Triple Halving will likely lead to a price explosion that I believe will allow ETH to easily overtake BTC in market cap. In this post I will discuss \*\*two\*\* key events that lead to the triple halving and why ETH will then easily overtake BTC as the most dominant crypto currency.  * The first event, and likely the least impactful of the two events will be caused by EIP-1559. On August 5th, EIP-1559 was passed, which means that 70% of the transaction fees in Ethereum will continually be burned. The more the network is used, the more fees will be burned. It is expected that with the deployment of EIP-1559, Ethereum would become net deflationary and stand at 2% negative annual issuance. In just one week over $100M of ETH was burned, this is insane. The drop in sell pressure represents a 30% reduction with the release of EIP-1559 which represent just over half of one BTC halving  https://preview.redd.it/cneo5zbzuqh71.png?width=853&format=png&auto=webp&s=636dc44bcedbadf71323f6e2ba73c5e23ced28f1  * The second (and very significant) cause would be the transition to Proof of Stake (POS) from Proof of Work (POW). To understand what this means we firstly need to understand Ethereum mining. As it stands, approximately 12,800 ETH (equivalent to $39,000,000) is rewarded to miners for running the Ethereum network and keeping it secure every day. Since ETH is still in a Proof of Work system most of this ETH is immediately dumped and sold into the market. Since the miners run a cash business, they need cash for electricity, equipment, paying investors etc. So everyday there is \*\*at least\*\* $39,000,000 worth of selling pressure for ETH each and every day. The implications for this transition means that ETH will go from a mine and dump economy (POW) to a stake and restake economy (POS). POS encourages saving as the more ETH you have the bigger your monetary benefit; this will not be for true all people as of course people will still sell a lot of ETH but most people will hold and restake their rewards as time goes by, enormously reducing sell pressure.  &#x200B;  https://preview.redd.it/2y8ue7j0vqh71.png?width=885&format=png&auto=webp&s=c5767436475c53af3d23266a2edb01c4cfde5998  So now you know what the ETH triple halving will lead to ETH being deflationary and have a \~90% reduction in sell pressure, we will discuss why ETH will overtake BTC in market dominance. Firstly, price leads narrative. A narrative by itself potentially creates a price increase. A narrative with a significant price increase validates the narrative and induces a price explosion. The following events will convince any investor that ETH is ultra sound money:  1. Exploding active accounts and transaction volume 2. Low fees - The most significant problem with Ethereum is scalability and is about to be solved, once and for all. The Layer 2 deployment is in full swing and the transaction fees will come down in the future 3. Powerful DeFi & staking yields 4. An environmentally-friendly Ethereum 2.0. ETH 2.0 will require 99% less energy to run and this is required to break into mainstream adoption. This is an obstacle where BTC failed. BTC is currently using up 0.7% of the world’s electricity while only serving 50 million people and you would likely need to use 70% to serve 5B (Full global adoption). Climate protection is the number one agenda in many developed countries and simply for this reason is why BTC will never truly be able to become mainstream  Another likely scenario is sooner rather than later Elon Musk will ride the ETH bandwagon, the news of Elon Musk praising Ethereum’s soon upcoming launch of energy-friendly Ethereum 2.0 POS will be enough to propel ETH to 5 digits alone whether this is a good or bad thing is another debate in of itself.  &#x200B;  https://preview.redd.it/wcamms32vqh71.png?width=1881&format=png&auto=webp&s=c1e0b067bcaae94c80fb6c4c3a8b63c7052a4816  https://preview.redd.it/74zr1o32vqh71.png?width=1895&format=png&auto=webp&s=f3b0a8f4b22364743a50e007bdfa4a5552df4548  https://preview.redd.it/lh1arw32vqh71.png?width=877&format=png&auto=webp&s=4248e6bd0ba1a270e655816f5034e4c04f67a42f  Now, we must also take into account that all this will be happening when there is record demand for access to the Ethereum blockchain for DeFi and NFT's. ETH is simply too important relative to BTC. Ethereum has flipped Bitcoin in every important metric, the last remaining metric is the market cap and that is only one 2.5x of Ethereum away.  But now you may ask, isn't this narrative already priced in? Well no, I don't believe so. The Triple Halving narrative only came into existence on April 27th (A 79 page investment report on why ETH could hit $150,000 by 2023 can be found on this link [https://drive.google.com/file/d/1bECqgijhgjdS782AB620gFjK5qx-vA99/view?usp=sharing](https://drive.google.com/file/d/1bECqgijhgjdS782AB620gFjK5qx-vA99/view?usp=sharing) ) how many of you had even heard of the ETH triple halving before reading this post? The average person will have no clue what even an Ethereum is but almost everyone has heard of BTC. In the last cycle the world discovered BTC not ETH, this cycle the world will discover ETH. BTC's first mover advantage will only take it so far and over time will begin to mean less and less. The shifting narrative of BTC to ETH will come as a result of BTC failing to be environmentally friendly and BTC will always fail at this hurdle as well as the very limited utility of BTC. Another reason why its unlikely this has been priced in yet is the Bitcoin halving was never priced in even though people knew about it 4 years in advance and it always led to a 100x price increase.  Now we must also discuss some major reasons why this laid out foundation for the price of ETH to explode could be hindered. The journey for ETH will not be straight forward by any means and will likely be plagued by delays and many other unforeseen events.  * Scaling could fail to reduce fees - Adoption can be too fast or Optimism is delayed or not adopted quickly enough by the main gas consumers (Uniswap and Tether). * POS is delayed - This is ETH we are talking about and this scenario is very likely to happen. POS is scheduled for late 2021 but will more likely come in early 2022 * Transaction fees end up being so low that due to scaling or lack of usage (bear market) - If Ethereum scales too well, fee burns would not have such a big impact on price.  There are also some other issues that are less likely to occur such as a $10 Trillion market cap ETH could cause a regulatory risk as an unregulated decentralized entity being worth so much is a scary prospect for many governments to deal with.  TLDR: ETH is already beating BTC in almost every important metric except market cap, with the EIP-1559 update and upcoming transition to POS ETH will loses 90% of its sell pressure or the equivalent of three BTC halvings in the timespan of 12 months leading to a price explosion that some predict could hit $150,000 by 2023 ([https://drive.google.com/file/d/1bECqgijhgjdS782AB620gFjK5qx-vA99/view?usp=sharing](https://drive.google.com/file/d/1bECqgijhgjdS782AB620gFjK5qx-vA99/view?usp=sharing)).   This is the gwei.",3480,2021-08-16 18:41:56,1745
ETH,cryptocurrency,"Kim Kardashian is recklessly pumping ""Ethereum MAX"" scam to her 250M followers on Instagram. This is the kind of scam the SEC must put a stop to, not prevent people from earning interest on their stablecoins. There are securities fraud laws against celeb pumping scamcoins",,4671,2021-09-10 18:40:15,833
ETH,cryptocurrency,"Rich Dad Poor Dad Author Says He's Buying Bitcoin and Ethereum, Economy Is Screwed",,6418,2021-03-21 14:42:07,734
ETH,cryptocurrency,'The Goal Of Crypto Is Not To Play Games With Million Dollar Pictures Of Monkeys': Ethereum Founder Takes Shot At Bored Ape Yacht Club,,4278,2022-03-20 18:17:06,540
ETH,cryptocurrency,Ethereum's cofounder Vitalik Buterin says we'll soon use 'soulbound tokens' to verify things like school and employment — all stored in a 'souls' wallet,,2581,2022-05-25 20:19:44,1092
ETH,cryptocurrency,Ethereum is like ‘Amazon in the 1990s’ — 21Shares,,447,2024-11-04 02:46:21,471
ETH,cryptocurrency,"Ethereum Finally Breaks All-Time High of $1,400!",,5448,2021-01-19 11:38:14,752
ETH,cryptocurrency,Ethereum co-founder moves $72 million in ETH to Kraken,,731,2024-11-30 14:41:56,197
ETH,cryptocurrency,Ethereum surpasses Bitcoin as the most popular cryptocurrency on YouTube,,5057,2021-04-09 10:36:52,595
ETH,cryptocurrency,Crypto community donates over $1.7 million in Ethereum and ERC20 tokens towards India's coronavirus fight,,6199,2021-04-26 08:38:20,447
ETH,cryptocurrency,PayPal Lets Users Transfer Bitcoin and Ethereum to External Wallets,,3473,2022-06-07 15:25:53,425
ETH,cryptocurrency,Just paid off my mortgage 20 years early and placed an order for my dream car. Thank you Ethereum!,Long time lurker here. I've been in crypto for the last 4 years. In 2017 I held all the way through the bull market and then sat and watched my portfolio shrink to nothing as I was convinced the bull run had not finished.   Fortunately I was patient enough and endured the whole bear market and yesterday with the new ATH of ETH I was able to sell enough to pay off my mortgage and place an order for my dream sports car.  I havent spoke on here much but I have lurked in the shadows from the start. Your posts and memes have got me through the bad times and helped me keep hold of my portfolio. Thank you to you all and I hope you are all in a similar situation!,4845,2021-02-03 08:37:52,614
ETH,cryptocurrency,"How much will the price of Ethereum move by Monday, May 3rd?","Reference price: $2,509.37  [Data will be sourced from CoinGecko](https://www.coingecko.com/en/coins/ethereum)  **FILTERING CRITERIA: 1w, USD, Linear Chart, Close Chart**  Winning results will be based on the price **at 12 pm PDT on May 3rd.** Results of the prediction will be revealed **between 11:59 AM PDT and 11:59 PM PDT the day after the prediction date.**  [View Poll](https://www.reddit.com/poll/mz2wfk)",6636,2021-04-26 17:23:24,404
ETH,cryptocurrency,"Ethereum's 99.95 % drop in energy usage will be equal to 15 big nuclear reactors, or 11 000 wind turbines","The Merge will reduce Ethereum's energy impact by up to 99.95 %. That's over [110 TWh of energy saved annually](https://ethereum.org/en/energy-consumption/), or 110 billion kilowatt-hours, equal to the annual energy output of over **15 big, 800 MW nuclear reactors.** Assuming that the reactors are never taken offline :)  Wondering how many wind turbines that is? In the US, the mean capacity of wind turbines is [2.75 MW](https://www.usgs.gov/faqs/how-many-homes-can-average-wind-turbine-power): large, off-shore wind turbines can have production capacities of up to 8 MW. The typical capacity factor is 42 %.  This means, that Ethereum's energy savings are equal to the annual production of almost **11 000 wind turbines.**  Nuclear: 110 TWh / (800 MW * 24 h * 365) = 15.7  Wind: 110 TWh / (2.75 MW * 24h * 365 * 42 %) = 10870",2068,2022-09-11 19:50:22,750
ETH,cryptocurrency,Ethereum Spot ETFs Approved by SEC,,961,2024-05-23 21:12:17,315
ETH,cryptocurrency,Get ready for Ethereum supply shock,"Since August 5, over 489,000 ETH has been burned. This is about $1,750,000,000 worth of Ethereum. Ethereum has also been consistently seeing deflationary days. Not only this, but Ethereum is also close to a triple halving. Perhaps the most bullish thing is that Crypto exchanges are running out of Ethereum.  &#x200B;  [ETH On Exchanges at their lowest level](https://preview.redd.it/smgzr8ne3is71.png?width=447&format=png&auto=webp&s=7925437721a3fa86a0a8934d0c4b13fb79fa5fa9)  And guess what? This is not even the biggest news for Ethereum. Ethereum layer 2 is also promising 100x gas cuts and is expected to be live by November. This is incredibly bullish for Ethereum. We can easily expect one of the largest bull runs ever if this keeps continuing. Miners are also losing momentum too. With Ethereum being burned more and more and exchanges almost running out soon, I'd say get ready for a supply shock soon.",2536,2021-10-09 15:48:26,1171
ETH,cryptocurrency,Ethereum creator Vitalik Buterin says Crypto price crashes Like Terra’s (LUNA) are good for Crypto because it exposes unsustainable business models,,3110,2022-09-03 22:17:14,392
ETH,cryptocurrency,Ethereum Price breaks $3600 Flashes Signal That Could Trigger a New All-Time High,,788,2024-11-27 22:09:22,151
ETH,cryptocurrency,"For anyone on the fence due to the recent BNB price spike, BSC is just Ethereum with a higher gas limit at the expense of centralization. Don't be fooled into thinking it's better or that Ethereum is ""outdated tech"", Ethereum has the most developers working on improving it by a very wide margin.",I've noticed a lot of people suggesting Ethereum is outdated tech and that BNB is the future because it has lower fees. That couldn't be further from the truth.  BSC is an Ethereum clone and all they did to reduce fees was increase the gas limit. That means that more transactions can be processed for lower fees but it requires more powerful hardware and thus more centralization. Ethereum could do this in 10 minutes if they thought that was beneficial to the network but they haven't because doing so would break a lot of the decentralization and security of the network.  Ethereum is so widely used and trusted **because** it is so decentralized and secure.  Ethereum has the most developers and researchers working on it than any other blockchain project by a very long way which means it is literally the bleeding edge of crypto tech. The Eth killers have a long way to go to knock it off as king of DeFi.  That's not to say that ADA and DOT aren't very promising projects but putting BSC/BNB in with them is almost laughable. It's just a clone! It will always be behind.  Check out Ben Cowen's recent [fundamentals video](https://www.youtube.com/watch?v=NguprqQyUDo) to understand a bit more.,2965,2021-04-06 14:10:49,971
ETH,cryptocurrency,Ethereum creator Vitalik Buterin donates $5 million in ETH to aid Ukraine,,4689,2022-04-07 09:37:32,313
ETH,cryptocurrency,"Ethereum breaks the $2.000 barrier again after 242 days, as the Shapella upgrade goes live!","In the last few months, Ethereum, and Crypto in general started to take off again. BTC went from $17k to now $30k, an almost 80% increase, in just 3 months, and equally Ethereum has risen from $1.2k to now $2k, which was hit 20 minutes ago.  The jump in the Ethereum price was of course driven by the Shapella upgrade, that went live 14 hours ago. This upgrade is Ethereum's biggest milestone since the merge, and it aims to enable validators of the Ethereum blockchain to successively withdraw their staked Ether. Also, transaction fees for certain activities on the network have been optimized.  Personally, i am really exited about the future and Ethereum and still see huge potential in a potentially upcoming bullrun in the Future. I could easily see it well above $10k in a few years, but only time will tell. Exited to hear your thoughts!",1630,2023-04-13 13:35:22,531
ETH,cryptocurrency,Ethereum’s Daily Active Addresses Surpass Bitcoin for the First Time in Crypto History,,3745,2021-06-29 09:57:04,563
ETH,cryptocurrency,Ethereum Gas Prices Plummet 93% to Reach Rock-Bottom Levels,,869,2024-05-13 10:43:32,329
ETH,cryptocurrency,Can Cardano Become The Third Biggest Crypto After Ethereum And Bitcoin?,,2583,2021-05-13 12:25:29,1080
ETH,cryptocurrency,"Why Bitcoin, Ethereum, and Solana Price Crashed, Triggering $950 Million in Liquidations",,707,2024-04-13 09:37:22,500
ETH,cryptocurrency,Ethereum Chain Splits Due to Bug: Devs Urging Users to Avoid any ETH Transactions,,2336,2021-08-27 20:12:09,959
ETH,cryptocurrency,Whale loses $24 million worth of ethereum to a phisher. This might be the largest amount phished from a single person,"Wallet loses $24.2 million worth of crypto, most of them in LSDs including 4851 reth and 9579 steth.   The transaction link in which the whale gets drained of his staked ether - https://etherscan.io/tx/0xcbe7b32e62c7d931a28f747bba3a0afa7da95169fcf380ac2f7d54f3a2f77913  The first question we will all have is ""how did this happen?""   > The victim gives an approval to the scammer by signing increase allowance transactions through this transaction - https://etherscan.io/tx/0xbb4fe89c03d8321c5bfed612fb76f0756ac7e99c1efaf7c4d99d99f850d4de53  This isn't the first time the phisher has successfully phished victims, they have a long list if previous victims. One of the scammers address is 0x4c10a462CD1e639Da8A062aE8a33a23401120ab1 which is associated with atleast 10 crypto phishing sites.   Source - https://twitter.com/realScamSniffer/status/1699605356740305198?t=sYFCsnjGUbL-LixPE1iDeA&s=19",976,2023-09-07 03:42:04,737
ETH,cryptocurrency,Vitalik Buterin Says Ethereum Merge Cut Global Energy Usage by 0.2%,,1933,2022-09-16 02:38:38,566
ETH,cryptocurrency,"Bank of Israel adopts Ethereum for digital shekel trial, and there’s more.","https://en.globes.co.il/en/article-bank-of-israel-adopts-ethereum-for-digital-shekel-trial-1001375607   So Globes is considered serious news source, and I found some key points from this article worth mentioning, it’s the little things in the article that excites me…  “This technology is being used in other trials conducted by central banks worldwide including in Australia, Hong Kong and Thailand.”  In the Hebrew version there’s a little more info..  https://www.globes.co.il/news/article.aspx?did=1001375518&fbclid=IwAR0q6mfGSFtbEk_ZYjbNqmWhWhyaHW06f7orWgDsQPhy77HC0r-vPyippCA  “About 74% of the world banks are in the process of adopting and experimenting with cryptocurrency pilot programs”…  Worldwide adoption? This is big 👏👏",3329,2021-07-05 05:18:33,531
ETH,cryptocurrency,Ethereum’s Vitalik Buterin Says Cardano (ADA) Is Introducing Fresh Ideas to the Crypto Space ((Any chance we could stop with the ETH vs. ADA bull? Go read his quotes. The truth is actually more nuanced)).,,2991,2021-06-12 13:24:53,636
ETH,cryptocurrency,The top post about the Ethereum supply shock is a misleading.,"Hello everyone,  There's a popular post on this subreddit that warns of an incoming Ethereum supply shock.  I would just like to point out that the graph is a bit misleading. Yes, the Ethereum reserve in exchanges is dropping, but the post makes it seem far more dramatic than it is.  Here's the link to the graph :  https://cryptoquant.com/overview/eth-exchange-flows/278   The post (intentionally or not) omits the left axis, which clearly shows that the supply on exchanges went from 24M to 18M.   Without the left axis, it would look like the reserves are dropping to zero, which is far from reality.  I just wanted to point this out for a clearer image.   People shouldn't blindly trust the information given to them, and always do your research. Your hard earned money is on the line.",2930,2021-10-09 20:05:54,526
ETH,cryptocurrency,Ethereum Co-Founder Vitalik Buterin Calls Bitcoin Cash a Failure,,1980,2022-01-02 09:23:22,942
ETH,cryptocurrency,Crypto investors hold breath as $200 billion at risk in Ethereum merge,,1675,2022-09-06 15:48:25,692
ETH,cryptocurrency,"65% of working Americans are willing to be paid in Bitcoin, Ethereum, and Dogecoin",,2571,2021-09-27 23:42:55,579
ETH,cryptocurrency,"In 24 hours, we will have the last ethereum update before The Merger. Still can't believe we have come this far.",In about 24 hours we will have the last Ethereum update before the merger to proof of stake from proof of work. A true milestone not only for Ethereum but for all of Crypto as this has been one of thr most anticipated events in crypto ever (maybe the most) and it's gonna have in just a few days...   Still can't believe that we have come this far it always seemed like we will never get this update after so many delays. But now on the Sep 15th it's finally here. Even if it's overhyped now it's truly something special here.,1894,2022-09-05 14:25:27,473
ETH,cryptocurrency,Ethereum’s energy switch saves as much electricity as entire Ireland uses | The success of The Merge concept may now serve as a roadmap to enable a switch from Proof of Work to Proof of Stake in Bitcoin.,,1298,2022-12-07 13:22:07,771
ETH,cryptocurrency,Why do people think that Cardano is faster than Ethereum?,"OK can we please have a technical discussion regarding the scalability of Cardano? Instead of the regular super highly upvoted moontalk (I know this thread will probably be downvoted to oblivion).  Cardano currently only handles 7 transactions per second on-chain. Ethereum currently handles 12-15 transactions per second on-chain. By tweaking some parameters in the future Cardano could potentially scale to 50 transactions per second on-chain which obviously still isn't enough for real world adoption. Cardano will scale off-chain with layer 2 solutions (Hydra). But they are awfully behind their competition in developing layer 2 support.  Don't take my word for it, even Cardano devs on their own subreddit admit all this.  See here: [https://np.reddit.com/r/CryptoCurrency/comments/mxjf0w/psa\_cardano\_ada\_runs\_at\_seven\_7\_transactions\_per/](https://np.reddit.com/r/CryptoCurrency/comments/mxjf0w/psa_cardano_ada_runs_at_seven_7_transactions_per/)  And here: [https://np.reddit.com/r/Cardano\_ELI5/comments/la7ptu/how\_many\_transactions\_per\_second\_tps\_can\_cardano/?utm\_source=share&utm\_medium=ios\_app&utm\_name=iossmf](https://np.reddit.com/r/Cardano_ELI5/comments/la7ptu/how_many_transactions_per_second_tps_can_cardano/?utm_source=share&utm_medium=ios_app&utm_name=iossmf)  So why do so many people think that Cardano is faster than Ethereum?  Also, I made this same post intended to discuss the scalability of Cardano two days ago. It quickly rose into the top 50 posts until a bot deleted it from the frontpage stating ""there are already 2 posts about this coin in the top 50"". But guess what, there are always 2 non-critical moonboy posts about Cardano in the top 50. So it's very unfortunate that technical discussions about this coin have no place on [r/CryptoCurrency](https://www.reddit.com/r/CryptoCurrency/). I will therefore keep posting this daily, until the day a bot doesn't delete it.  Edit: Since this time, this post didn't get deleted, I will add this. I have nothing against Cardano. But I have noted that there currently exists a widespread lack of knowledge regarding the scalability of blockchains in general and Cardano in particular. This is an extremely hard technical problem that haven't been solved for over 10 years. Cardano is not offering a unique quick fix to this anytime in the near future. But I am happy that we now have more projects than ever (including Cardano) that are working on it.",2103,2021-05-30 23:49:00,925
ETH,cryptocurrency,Ethereum cryptocurrency completes move to cut CO2 output by 99% | Cryptocurrencies,,1888,2022-09-15 11:26:55,423
ETH,cryptocurrency,Blackrock and Fidelity bought half a billion worth of Ethereum,,798,2024-12-12 16:21:25,100
ETH,cryptocurrency,"BlackRock ETF Leak Triggers Bitcoin Price Surge Past $45,000 After Goldman Sachs Issues Huge 2024 Ethereum, XRP, Solana And Crypto Prediction",From the article: “Bitcoin price is set to close out the year as one of the best-performing assets after gaining around 160% thanks to soaring expectations that Wall Street giant BlackRock is about to blow up the bitcoin market”,1334,2024-01-02 03:42:39,208
ETH,cryptocurrency,JPMorgan Says Bitcoin Halving and Ethereum Upgrade 'Are Largely Priced In',,770,2024-02-27 13:37:27,318
ETH,cryptocurrency,"Ethereum Price Prediction: Can ETH Break Above $10,000 in 2024?",,630,2024-02-11 11:24:08,440
ETH,cryptocurrency,"Ethereum Could Top $14,000 Next Year Alongside Bitcoin Boom: Standard Chartered",Anyone else holding and buying more ETH?,682,2024-03-24 19:04:01,315
