Crypto,Subreddit,Title,Content,Score,Created_At,Comments
ETH,cryptocurrency,Ethereum falls to 4-year low against Bitcoin as BTC breaks above $94k,,2759,2024-11-20 14:27:25,535
ETH,cryptocurrency,Realised today that I don't like where Ethereum is going,"Background :  I only hold BTC and ETH (70%/30%).   I've been around in the crypto space for a very long time.   The following is my own opinion and this a this a friendly discussion about ETH only. I'm not looking for alternatives, I already know most of them.  Lately, I've been really considering swaping my ETH for BTC (at least for now) for the following reasons:  * Ethereum team pretty much completely gave up on scaling the main chain. they are now solely focused on improving L2s and pushing people toward using them. * I think L2 suck, and that they're not user friendly. some people might argue that bridging tokens is ""easy"", but I think you're missing other important points : 1- whenever i want to get paid in ETH from a business or someone, NO ONE EVER has a withdraw/payment with L2s. same goes with sending money to normal people. 2- This is pretty much how L2 feels to for anyone I've ever talked to : Risky / Complicated / afraid coins will be lost (multiple chains and names confusing) / afraid to use a malicious site / Fuck this, I rather just use another cheap L1 chain. * This is how I see BTC/ETH : -I hold BTC because i believe it's the best store of value (like gold) -I hold ETH because i believe it's a cheaper way to move money, while also being safe store of value that's not gonna dump and die in the future. The thing is now, I'm starting to believe that Ethereum lost the position as a cheap L1 chain and it's never getting it back because they don't care about cheap L1 anymore. (like how Vitalik's gas limit proposition got ignored and sharding on L1 not being a priority anymore). Your bags aside, how can you possibly think that most people will be using L2s in the future, when you can clearly see that people are having a hard time just wrapping their head around basic crypto stuff ? I just can't see it.  **UPDATE** : Thank you all for your answers and ideas. I came now to realization that it is unreasonable to expect ETH to achieve low fees on L1, while at the same time keeping the same level of decentralization and security. I still believe L2 as it stands is not user friendly enough. and thanks to u/kumomax1911 comment, I know now that there is ongoing work to make L2 more seamless experience without the need for bridging (still need to search more about it) . I think that would be a good compromise to the current situation. only time will tell.",758,2024-03-18 14:48:01,863
ETH,cryptocurrency,Ethereum just hit a brand new 3.5 year low against Bitcoin.,"ETH just hit a brand new 3 and a half year low against BTC after touching .03462 beating it's last 3 and a half year low of .03465 set just 8 days ago on Nov. 06th 2024. (.03462 means 1 eth is worth 3.46% of 1 BTC. )  In fact this means ETH has wiped all out gains against BTC since April 2021 when ETH was \~2k and BTC was around \~$60k. Since then ETH has completed the merge moving it from POW to POS and Proto-Danksharding (which dropped the gas cost on L2s). Still in comparing it's value against BTC, ETH has officially lost all of it's bear market gains.  [https:\/\/www.coingecko.com\/en\/coins\/ethereum\/btc](https://preview.redd.it/d2gwy67eax0e1.png?width=930&format=png&auto=webp&s=f1797ed2c0843594037ab12f5d8b26ad9a0ba558)  What you might not know is ETH is not alone lots of alts continue to be down against BTC.  Chainlink to BTC is also sitting at a 5 and a half year low.  [https:\/\/www.coingecko.com\/en\/coins\/chainlink\/btc](https://preview.redd.it/ku1r1nkndx0e1.png?width=986&format=png&auto=webp&s=71bed011d770afdf8158f46b5178b18dd0594f49)  Perhaps one of the worst performing alts and sub darling, DOT continues to hover near an ATL against BTC.  [https:\/\/www.coingecko.com\/en\/coins\/polkadot\/btc](https://preview.redd.it/k14atxujex0e1.png?width=948&format=png&auto=webp&s=e8b9f0f20a8ebf5ead8cfb60fb7f892d922762cb)  This list is not comprehensive but many alts are barely above recent bear market lows.  Just for fun I'll also include the Moon to BTC Chart which isn't great but is somehow better looking than a lot of the alts.   [https:\/\/www.coingecko.com\/en\/coins\/moon\/btc](https://preview.redd.it/ogsd6930hx0e1.png?width=952&format=png&auto=webp&s=19b9d221c0d5da03c564ca2e35ba6e15a68642ed)",1214,2024-11-14 20:27:07,521
ETH,cryptocurrency,Donald Trump is holding over 60% (of his crypto assets) in Ethereum,,1839,2024-11-25 17:42:05,355
ETH,cryptocurrency,What Does Ethereum Need to Reach Its Full Potential?,"I've been holding Ethereum for years and, while I've made decent profits, its growth has been slower compared to Bitcoin. Ethereum has so much potential, but its price hasn’t seen the same explosive growth that Bitcoin has. What does Ethereum need to experience a significant price surge? Is it more network upgrades like sharding, greater adoption, more institutional investment, or something else entirely? I’m really curious to hear from others what they think could help ETH reach its true potential and drive long-term growth in the market.",42,2024-11-05 16:14:34,146
ETH,cryptocurrency,Vitalik Buterin Defends Ethereum Foundation Amid Criticism Over Consistent ETH Sales,,1407,2024-10-26 10:35:56,458
ETH,cryptocurrency,"Ethereum's ""The Merge"" is finally live!",,8322,2022-09-15 06:37:23,1840
ETH,cryptocurrency,"BlackRock Closes the Door on Altcoins: ""Only Bitcoin and Ethereum!""",,1502,2024-12-13 18:45:36,205
ETH,cryptocurrency,GameStop is building an NFT platform on Ethereum,,18583,2021-05-25 21:48:31,1717
ETH,cryptocurrency,Elizabeth Warren is now very concerned with high Ethereum network fees. She says fees and exchange outages could wipe out small investors. This lady needs to move on to a topic that she understands,,8556,2021-09-15 15:36:51,2490
ETH,cryptocurrency,"Donald Trump's NFT Collection Sold Out, Rakes In $4.45M In Just 12 Hours - Ethereum (ETH/USD)",,4144,2022-12-16 17:09:06,1322
ETH,cryptocurrency,"Bitcoin To $200,000, Ethereum To $10,000 And Crypto Market Cap To 4X By End Of 2025, Says Standard Chartered",,1241,2024-11-10 02:47:46,268
ETH,cryptocurrency,'Glory To Ukraine:' Russian-Born Ethereum Creator Vitalik Buterin Says 'Very Upset By Putin's Decision',,10501,2022-02-24 04:51:03,781
ETH,cryptocurrency,Ethereum Classic and Bitcoin Cash are pumping...which means the latest batch of noob retail investors have finally arrived!,"I think many of you would consider Ethereum Classic a terrible investment, considering (1) it was the result of a hack, and (2) the hacker still has their bags of ETC available, which they periodically dump on unsuspecting investors. Bitcoin Cash doesn't have such a problematic origin, but might also be considered an unwise purchase given the lack of usage and development compared to BTC and other good projects.  So, when I open the charts and see that specifically BCH and ETC have been pumping hard for the last couple of days, my only conclusion is that new retail investment money has arrived and these noobs are dropping cash on 'cheaper' projects with the name Bitcoin and Ethereum in it. I should know, I did this exact thing myself earlier this year!  Here's hoping this signals the start of a another massive pump too.  Edit: spelling",6939,2021-11-10 12:41:18,1775
ETH,cryptocurrency,Ethereum hits multi-year low against Bitcoin erasing all gains since 2021,,985,2024-10-28 13:32:52,344
ETH,cryptocurrency,"Cardano network clogged, Avalanche congested a while ago, Polygon almost stopped completely due to some flower picking game. Are these really going to work as an alternative to Ethereum with its high gas fees?","Before anyone goes nuclear I will say that ETH is too damn expensive. But are the alternatives really so much better?   Recent news about Cardano congestion shooting up around 90% and more, Polygon being borderline unresponsive during Sunflower popularity/incident, and AVAX fees getting sky high while network suffered congestion a few months ago.  If these networks had the Ethereum levels of activitynon them, they wouldnt hold for long. Cardano has a handful of dapps and its already clogged? Same with Polygon. 1 dapp putting whole network on stop is really not what people would expect of the so called ""next gen eth competitors.""  While I 100% agree that gas fees on Ethereum are absurd, I wonder if the alternatives that we have at the moment in top10 are going to solve that. All claim insane TPS and finality times, but when the shit gets real, the fees and network congestion go up to the sky.",4623,2022-01-27 16:14:15,2952
ETH,cryptocurrency,Ethereum founder Vitalik Buterin says long-awaited shift to ‘proof-of-stake’ could solve environmental woes,,8622,2021-05-27 11:46:02,931
ETH,cryptocurrency,"Bitcoin and Ethereum Reaches New ATH at $62,914 and $2216 Respectively",The first time Bitcoin and Ethereum reach ATH at the same time in a long time.  Congratulation to all BTC and ETH holders who have held it through consolidation of long and hurtful month. It sucks when you see other coins pumping and BTC and ETH stays where it is but nothing hurts more than selling the coins you believe in to chase the coins that are pumping just to missed the pump of the coins you believe in. (been there done that)  Lets celebrate today and hope BTC and ETH can find footing above previous ATH. To infinity and beyond!!,7494,2021-04-13 08:50:41,1136
ETH,cryptocurrency,"A 12-Year-Old Made Over $160,000 in Ethereum on NFTs in One Day",,6210,2021-07-23 19:47:58,1157
ETH,cryptocurrency,"Ethereum co-founder on why he got into crypto: Empower the little guy, 'screw' the big guy — 'they already have enough money'",,9174,2021-05-21 08:20:24,790
ETH,cryptocurrency,"Tyga Deletes OnlyFans Account, Plans to Launch Competitor Platform Myystar Myystar will only be taking 10 percent of creators’ earnings, a steep difference from OnlyFans’ 20 percent fee. “Creators will have the ability to sell NFTs on the Ethereum blockchain, as well as boasting features relevant to",,6491,2021-08-22 16:03:51,850
ETH,cryptocurrency,The Ethereum Value Proposition: Dark Horse Edition,"If you’ve been in this sub for years, you may remember a series of posts here dubbed “ethereum value proposition” back in 2021 by yours truly during an epic eth fud campaign before ETH went on its face ripping rally.   Check the receipts, I did a multi week series in mid march 2021 and days later eth made the face melting gains 3x and up.  Why am I telling you this? To toot my own horn? No.   It’s because the reason I made those posts years ago was because the market was being HIGHLY irrational toward ETH and I believe it is doing it again, and where irrationality exists, opportunity for gains exists as well.  If you’ve had a pulse in crypto the last 3-6 months you’ll know everyone and their mom has turned bearish on ETH. In 2021 the criticism was “EtH cAnT ScALe”, now it’s “EtH is DeD”  Nonsense. And here’s why:  Tradfi has quickly realized that the megalithic opportunity in crypto is stablecoins (see https://x.com/nic__carter/status/1857408855719674075).  As you can see stablecoin volume has skyrocketed in the last 4 years eclipsing PayPal, bitcoin, remittances, and ALMOST approaching the levels of VISA, the largest payment processor in the world.  Guess where the VAST majority of stablecoin volume happens? Yep Ethereum and it’s L2s. Over 70%.  “Oh but ETH L1 has no usage no one uses it or oh it’s L2s are dead bla bla bla.”   No, ETH has significantly scaled by introducing “blobs” a few months back. check L2beat, Ethereum and its L2s users and transactions are near all time highs for an aggregate of ~370 TPS currently. Source: https://l2beat.com/scaling/activity  “Oh ok so some people use ETH big deal, but it’s still not a good investment”  If that were true,why then while everyone and their mom has been fudding ETH, Blackrock, (the largest hedge fund in the world)in the last 2 months has increased it’s holdings of ETH in its ETFs by a whopping 65%? Source: https://x.com/EthereanVibin/status/1858254969389863290  Why is over 95% of Blackrocks “BUIDL” fund of over 500 million dollars built on Ethereum?  Why are states like Florida and Michigan starting to acquire ETH? Florida now holds over 800 million in crypto related investments and Michigan 11 million: https://www.ccn.com/news/crypto/michigan-largest-ethereum-etf-holders-us/  “Oh but Bitcoin is the only scarce asset with real value for holders, everything else is just a scam or gambling”  Since proof of stake and the burn was implemented about 3 years ago ETH has had HALF the inflation rate of bitcoin: https://ultrasound.money/  In laymen’s terms, bitcoin is being printed at twice the rate of ETH. People literally do not realize this. This is beyond significant.  Michael Saylor himself, the bitcoin messiah has said that bitcoin HAS to figure out a way to generate yield, because just holding it long term is not economically feasible, direct quote:  “The point is If the capital doesnt generate a return  its a non performing asset, you need to address the issue. If I put $100B into $BTC and the yield is 0%, thats just as bad as having $100B bonds that pay 0% yield. In both cases theyre non performing""  Source: https://x.com/etheraider/status/1836493170772971646  What this means is that Saylor fully recognizes that yield is KING.  Everyone knows that stocks that provide quality yield command a premium, you don’t think crypto assets will command the same premium anon?  But don’t confuse yield with inflation, yield comes from “activity/MEV/fees”, because if you have high yield due to inflation and not from actual usage of the chain, then your yield will be high but so will the inflation of your coin so you never come out ahead.  And what chain has the purest native premium on yield? The one with the most activity/mev/fees RELATIVE to its inflation, in other words Ethereum.  Saylor for a long time discredited eth because he said it was a security. Now it officially is not. He now says he wants a “form of bitcoin” aka a scarce asset that gives him yield…..  You do the math.  Saylor may never capitulate and buy ETH due to pride or maybe because he’s built a religious cult following and attack the fragility of bitcoin maximalism by holding another asset but that doesn’t mean you have to repeat his mistake.  Is ETH the BEST asset in crypto? No, there’s no way I can make that claim about any asset without being biased or disingenuous.  Is it ONE of the best risk adjusted reward plays right now given history, tech, present social bias, and network effect?  Absolutely.   I could go on and on about how ETH has always outperformed BTC in bull cycles, how the weekly RSI is at all time historic lows and therefore represents a legendary buying opp, etc etc  But I’ll end with this:  3 years ago the level of FUD surrounding ETH is what prompted me to post this series because it was so over the top irrational.  The same pattern is repeating now.  If you listened then and did the counter trade congrats. If you didn’t, here’s your second chance  Don’t fall for the CT FUD doomloop.  ETH is the dark horse this cycle.  Load up, you won’t regret it.",639,2024-11-18 14:45:15,372
ETH,cryptocurrency,"Bitcoin to $1M, Ethereum to $180,000 by 2030: ARK Report",,3682,2022-01-26 14:46:24,1585
ETH,cryptocurrency,Loopring: What Is LRC and How Does It Make Ethereum Gas Fees Cheaper?,,4787,2021-12-31 02:04:59,902
ETH,cryptocurrency,"Ethereum Reaches New ATH at $4,700 With Market Cap of ~$555 Billions Dollar","The last time ETH reached ATH was just less than a week ago and now we are back to the sky!  Congratulation to all ETH holders who have held it through the consolidation of long and hurtful months. It sucks when you see other coins pumping but ETH stays where it is, but nothing hurts more than selling the coins you believe in to chase the coins that are pumping just to miss the pump of the coins you believe in. (been there done that)  Let's celebrate today and hope ETH can find footing above the previous ATH. To infinity and beyond!!",4887,2021-11-08 01:09:17,967
ETH,cryptocurrency,Ethereum hitt new ATH of $1600 !!!,"Only after a day of hitting the new ATH of $1500, we have already hit a new ATH of 1600$. Ethereum is in a major upwards trend and will probably go even further. This community is really strong supporter and hoping we can push this forward.   1 december 2020: $600  1 january 2021: $741  1 february 2021: $1315  &#x200B;  https://preview.redd.it/fwte343hcaf61.jpg?width=357&format=pjpg&auto=webp&s=96c828ecdc45c5cff025b763069fb8f99eb988df  Even tho it has been a really exciting time, more to come!",6417,2021-02-03 16:00:47,1088
ETH,cryptocurrency,"Three factors driving Ethereum to $10,000. Yes, really",,907,2024-11-26 13:05:40,209
ETH,cryptocurrency,Amazon just added ETHEREUM SUPPORT to AWS!,,8679,2021-03-03 00:26:27,667
ETH,cryptocurrency,Ethereum CEO has immediately accepted President Biden's request to bring down gas price and has reduced it to 4 gwei! Rejoice everyone,"US President Joe Biden yesterday requested companies running gas stations to bring down the price as we are in a time of war and global peril.   [Joe Biden: Bring down the price you are charging at the pump to reflect the cost you’re paying for the product. And do it now.](https://preview.redd.it/o2lqv62t4c991.jpg?width=2818&format=pjpg&auto=webp&s=f47b9a08c4e06e09eb787be36c9d149d38f26f95)  Accepting this request, one of the largest companies running gas stations Ethereum's CEO has directed all gas stations to bring down the price at the pump with immediate effect.   As a result, gas prices at the pumps have dropped to as low as 4 gwei!  [Gas prices reach lows.](https://preview.redd.it/s7ks3mgc5c991.png?width=717&format=png&auto=webp&s=200c535dcb493095037847078a6f96f511bd59cf)  [Cost for an NFT sale on OpenSea has fallen to $1.78 from several hundreds of dollars at the peak!](https://preview.redd.it/ojuzm4376c991.jpg?width=1336&format=pjpg&auto=webp&s=b35e92ad93950fca8d2a8aced7737d090f373add)  Crypto users and degens thank the joint effort of President Biden and Ethereum's CEO in making gas affordable for citizens again.",4764,2022-07-03 11:12:09,502
ETH,cryptocurrency,"Ethereum co-founder Vitalik Buterin revealed he profited more than $4 million from a $25,000 investment that he made into Dogecoin during 2016. But true to form, he gave it all away to charity.",,10267,2021-06-10 00:24:12,506
ETH,cryptocurrency,Ethereum to overtake Bitcoin as ETH enters 40% rally. What’s everyone’s thoughts on this?,,3595,2021-09-01 09:29:00,1543
ETH,cryptocurrency,"This outrage is insane, BUT, Ethereum and Bitcoin are still... working.","Yeah, banks went down... airplane companies went down... 911 went down and many many many other things went down. But, crypto... Ethereum and Bitcoin (Solana probably went down too) are still up and running. There's absolutely no DISTURBANCE in the Ethereum nodes. And this makes Ethereum and other currencies the future of money! Nothing can stop them and I think this proves why Ethereum is really important for the future.     I think today, was an amazing day for cryp...I mean Ethereum! Ethereum is truly a world's currency and we just forcefully realized how much we need ETH!",847,2024-07-19 13:21:07,428
