Crypto,Subreddit,Title,Content,Score,Created_At,Comments
XRP,cryptocurrency,Convince me that Ripple (XRP) is not a Ponzi Scheme…,"Out of all the big players in the crypto landscape, Ripple stands out to me as a Charlatan.  A for profit company that is trying to get banks and central banks to adopt its currency. Banks and central banks will be the last to adopt crypto and will only adopt something that the masses use.  This company only has a billion dollars in cash, has 1100 employees, and the rest of its assets, purportedly 25 billion, is in mostly ripple.  So essentially anytime the price goes up they are incentivized to sell Ripple from the balance sheet to help cover cost. What I don’t get is the ripple market cap is suppose to be 27 billion on top of all this per coin-market-cap.  What am I missing here?",307,2024-07-01 07:08:59,585
XRP,cryptocurrency,Why Ripple's XRP is poised for $10,"I will present the case why XRP will re-enter price discovery this year due to the very bullish chart structure. I believe that XRP is imitating Bitcoin's previous cycle from 2018-2021. Of course, this is not financial advice, you must proceed at your own caution and exercise appropriate risk management but I wanted to share my thoughts.  &#x200B;  https://preview.redd.it/rsiesesy7vsc1.png?width=1593&format=png&auto=webp&s=918f22ab28ac6db98f6a9d4705e8e5e42c59de47  The image is the Bitcoin price chart during the last cycle. We see Bitcoin crash to 3k in 2018, followed by a retrace to the 0.618 retracement to 14k in 2019, then re-accumulation back down to the lows in early 2020 followed by price expansion, almost reaching a full 4.236 extension in 2021.  &#x200B;  https://preview.redd.it/wju0aun18vsc1.png?width=1581&format=png&auto=webp&s=e1b50d93e9f28ef43bb1520d239cc399650e0b18  This image is the XRP price chart. XRP is showing a similar structure to Bitcoin's previous cycle but just behaving much more slowly which is why most people think the project is dead, retail investors don't have much patience. We observe that XRP crashed to $0.11 in 2020, then retraced to around the 0.618 at $2 in 2021, followed by re-accumulation in 2022-23 and now I believe we are about to enter the price expansion phase. If XRP was achieve a full 4.236 extension like bitcoin, then the target would be above $10.  Both the structure of bitcoin and XRP show: crash, retrace, re-accumulation and now price expansion.  However, I would like to offer some balance as well and want to re-iterate that XRP must break the 2021 high of $2 to show confirmation of an uptrend. Otherwise, it may make another lower high and that would cause XRP to deviate away from what BTC did last cycle. This bullish thesis hinges on XRP being able to break that 2021 high, so pay close attention to that.  I also believe that 2024 will be make or break for XRP. As I expect the inevitable hard landing of the US economy in the second half of this year. It's pretty much now or never for coins like XRP. If it is unable to do anything meaningful this year, I will have to conclude the project is dead because once the macro conditions turns ugly, there is no chance for any crypto to do well in that environment. The stock market is the force that drives crypto bull runs. However, I remain hopeful that we get our XRP bull run this year.  Most people on this subreddit hate XRP which is again another reason to be bullish. The herd of retail investors is generally wrong. They all expected 100k in 2021, they all thought crypto died in 2022, they all expected 12k in 2023, they hated Solana at the lows...the list is endless. When has the herd of retail investors ever been right about anything? Now they all expect the bull run to last until late 2025 lmao.  I am a firm believer of ""show me the chart and I will tell you the news"", so I am expecting some bullish narrative to emerge for XRP, who knows. Regardless, I think we can all agree that 2024 will be pivotal for coins like XRP. Look forward to hearing your thoughts!  Edit: Wow so much negativity. The more you insult XRP, the higher it will go. I didn't make the rules. It's just how the universe works.",0,2024-04-06 14:01:44,180
XRP,cryptocurrency,XRP Price On The Brink Of Another Breakout: The 'Game-Changing Implications' Of Ripple's RLUSD Mints,,182,2024-12-03 21:13:38,187
XRP,cryptocurrency,Ripple (XRP) is a different animal compared to other cryptos,"Since XRP is quite old by today's standards, many people believe and trade it like any other crypto. But XRP has a complete different approach to the technology and should be therefore also treated differently.  Ripple is not only a chain, but has a for profit corporation behind it. Its business model is based on fiat to fiat money transfer with XRP as an intermediate token. For this to properly work the price of the coin is irrelevant, but its liquidity is important. To achieve this, the Ripple Corporation can mint and burn XRP on it own as they seem fit.  People buying just the token are just getting the excess the corporation does not use anymore. On the other hand, the Ripple Corporation is directly funded through these sales. But once they are sold, they have no value to the business model. They don't need to buy some for liquidity, they can just mint some more. To be more clear, by buying XRP one does not participate in the success of Ripple just funding their operations. Quite some one sided business.  To answer some obvious questions: the time frame for the fiat to fiat transfer is short enough, so that price changes for XRP are irrelevant. Blockchain technology is used for having a ledger that holds all transactions in a simple and seamless way. It is also obvious that the corporation has no interest in decentralization or development of its chain technology. Naturaly, its business model creates some serious volume on the chain which may make it look like being ""legit"".  If do not want to fund this corporation without benefits, then you probably don't want to trade XRP.",0,2024-07-17 19:54:31,50
XRP,cryptocurrency,Why do people still invest in XRP?,"Genuine question. It has been an under performer since the high in the 2017 bull run, since then it hasn’t been able to make new highs. The btc/xrp chart is literally down on Btc after 10 years, ripple labs is known to continuously unload tokens onto the market keeping the price down.  I was heavily invested in 2018-2019 when I entered the market but then ended up selling it all into eth which was a really great move, since then I haven’t looked back.   Why do you guys still believe in xrp?? I don’t get it, it’s never a good sign when a coin can’t break its previous highs in a bull run. And you can’t entirely blame that on the SEC case, even without it I don’t think it would’ve gone much higher as payment solutions was not a narrative that got much attention that cycle.. and this cycle coming up I just don’t see people coming in getting hyped about xrp.  It just doesn’t stand out in any facet and I argue its time in the top 10 is coming to an end, it’s still hovering around the same price it was over 5 years ago when I entered the market. You’d be better off with most stocks at this point. what is the reason you’d pick xrp as an investment?? I just get so confused when people still think it’s a good addition to a portfolio  Edit: I actually agree with the people saying this sub is like the best reverse-indicator and I've used it before on the Solana bottom when it was being fudded hard by this sub. That being said I've heard 100s of 'XRP to the moon next week!' or 'SWIFT adoption $589 XRP in 1 month!' videos over the last 5 years and XRP has never performed, I actually hope you XRP holders are right and it moons.. I just don't see it. I'll revisit this later on in the bull market and lets see how XRP has faired to the rest of the market. It will go up with the rest of the market for sure, like it always does. I just think it will be an under-performer compared to other coins. Good luck XRP army! I'm not a hater just think it's a bad pick for a bull market",618,2024-01-31 00:23:04,589
XRP,cryptocurrency,Ripple is funding propaganda against Bitcoin by teaming up with the government to spread energy FUD,"Ripple labs has been funding ""research"" along with government entities to spread propaganda against Bitcoin and mining.   In 2021, they funded a hit piece that claims energy prices for consumers in New York has increased by $6 per month because of mining.   [Claim: Mining drives up household electricity bills](https://preview.redd.it/m0ta2tae4xb81.png?width=1318&format=png&auto=webp&s=8079d16b0fde7bc74ebd204d4362ff823da26d3f)  Surely its not the soaring costs of natural gas that is driving up electricity prices, but mining?   [Since June 2020, Natural gas prices have gone up by 350&#37; in the USA \(Henry Hub natural gas futures rolling contracts\)](https://preview.redd.it/iprxvhfj5xb81.jpg?width=2610&format=pjpg&auto=webp&s=e4da2516b82eb585706d4d1af417320b5b82889e)  [Not just in USA, in UK, natural gas is at decadal highs. ](https://preview.redd.it/v2gl6rmx3xb81.jpg?width=3094&format=pjpg&auto=webp&s=9dae03fee6dfbbfaf58df82519db809462d01254)  Surely, electricity prices that consumers pay have nothing whatsoever to do with inflation, or soaring gas prices that are in decadal highs.. but is due to bitcoin mining?!  Crude oil WTI futures are currently at 84, for comparison it was around 56 in Nov 2019 (pre pandemic). The last time WTI was above 80 was all the way back in 2014. Increasing crude oil natural gas prices, along with inflation that is at multi-decade high is not the reason for increase in household electricity, but its bitcoin mining that is responsible..   [Thats according to this study funded by Ripple in collusion with the Department of Treasury. ](https://preview.redd.it/a4z5aqnyaxb81.jpg?width=1944&format=pjpg&auto=webp&s=6656489541bece07a0e9b83837d42345157f987c)... The same Department of Treasury headed by another well known Bitcoin hater Janet Yellen, who earned $7m as ""speaking fee"" from the same banks she is supposed to regulate but has tried to stifle Bitcoin and crypto at every opportunity.   Research with ""financial support"" is nothing but propaganda, especially when it's funded by a competitor to bitcoin that lobbies with the government. Ripple continues to be a centralised premine scam created to enrich its founders.   Ripple has also cozied up with the likes of WEF, the very organisations Bitcoin was created as a fuck you to. [https://www.weforum.org/organizations/ripple](https://www.weforum.org/organizations/ripple)  As its price and narrative around the shitcoin has stagnated, Ripple is resorting to dirty political tricks to get a leg up. As usual, they will fail.   The narrative that bitcoin mining companies cause increase in electricity bills in NY is rubbish, as the largest BTC mining companies in New York produce their own energy. Infact the last one to start mining in NY is a hydro electric plant that was unused for years, before they started mining Bitcoin last year.   [https://www.timesunion.com/news/article/Mechanicville-hydro-plant-gets-new-life-16299115.php](https://www.timesunion.com/news/article/Mechanicville-hydro-plant-gets-new-life-16299115.php)  The other large mining company Greenidge Generation also produces its own energy.   Edit: Buttcoin losers in comments say ""reee bitcoin move to POS or govt will ban it""  Yeah not too bright, the whole point of Bitcoin is that it cant be banned unlike the proof of stake shitcoins you support that can be created out of thin air at the press of a button and shut down at the press of a button.  Another one who is literally a war monger calling for Ukraine invasion but pretends to care about global e-waste. Lmao. Bitcoin haters are really a funny bunch   Edit: Ripple shills keep brigading and claiming where is the paper, of course if you are as bricked as a ripple fan boy you need to be spoon fed everything. Well here is the paper: https://papers.ssrn.com/sol3/papers.cfm?abstract_id=3779720  And if you open up the first page of it, says  > **Benetton and Compiani acknowledge financial support from Ripple’s University Blockchain Research Initiative.**  i.e this whole ""paper"" is nothing but a hit piece propaganda sponsored by a competitor  The other writer of this paper is Adiar Morse, who conveniently works for the Dept of Treasury under Yellen:   https://newsroom.haas.berkeley.edu/prof-adair-morse-joins-biden-administration-as-a-treasury-department-deputy/  Seems like natural career progression - collect funds from Ripple to publish propaganda against Bitcoin, and get hired by Yellen who has been promoting propaganda against crypto for years now. Nothing to see here.  Final Edit: Jjust look at the number of freshly created ""Tin"" accounts that have popped up in the comments to shill for XRP. Didnt realize 2017 left so many bag holders. It must be real miserable with these heavy bags that are at 1/3rd of their 2017 ATH, while almost every other coin has gone up hundreds of % and made new highs this cycle. Thats what happens when you become exit liquidity for mccaleb, garlinghouse etc.   Lol at the shills shouting ""REEE ripple is a company XRP is decentralised token"". They really did you good with this one small trick.  Thats also the reason garlinhouse drives a shiny car while you are down 50% on your shitcoin investment.   The D in XRP stands for decentralised. It was always a premined scam token and will always be one. Thousands of tin bagholders wont change this.",3879,2022-01-15 22:15:00,2654
XRP,cryptocurrency,Ripple co-founder Chris Larsen says he is donating $10 million in XRP to Kamala Harris.,Chris Larsen announced on the social media platform X.,781,2024-10-21 17:41:47,310
XRP,cryptocurrency,Charles from cardano was right. You need ripple to win or this lawsuit. The SEC is going to open up CoinMarketCap and start litigating down the list. Do not let tribalism get in the way of this.,"By winning the suit against ripple and the execs (for anyone who’s been following the suit ripple are absolutely smashing it) there will be case precedent.   They will have the big fish and case law.  This means any ico or sale of crypto from the inventors of said crypto will be targeted. There’s one thing the SEC likes and that is money.   They can see an untapped wealth of fines and settlements here and they want to be the regulator who controls crypto in the USA. You might hate Xrp, but right now ripple and their lawyers are preventing the SEC from getting their hands on the crypto market.  I have been following this case very very closely, the BtC Is The BesT tHe ResT aRe ShiTcOinS mentality is fcking stupid. If you cannot see what the SEC is trying to do here then good luck. Legit good fcking luck. EVERYONE should be paying very close attention to their strategy I KNOW those who are launching ICO's and have done in the past are and are seeking legal advice. The SEC is going for the keys to the kingdom via ripple.  Fortunately  Ripple, Brad and Chris went and hired a whole bunch of ex sec lawyers, including commissioners to represent them and they are doing an exceptional job.",4131,2021-03-28 23:10:55,1061
XRP,cryptocurrency,SEC vs Ripple case ends: Ripple must pay 125 million dollars,"Judge Torres has made her final ruling in the SEC vs Ripple case, with a judgement that Ripple must pay fines/ penalties of just over 125 million dollars. This is much less than the 2 billion dollars the SEC was asking for.  This means the case is now over, though either side can appeal. If that happens, it could take a couple of years to resolve. However, the SEC cannot appeal the ruling that XRP is inherently not a security.  [https://www.courtlistener.com/docket/19857399/securities-and-exchange-commission-v-ripple-labs-inc/?filed\_after=&filed\_before=&entry\_gte=&entry\_lte=&order\_by=desc#entry-974](https://www.courtlistener.com/docket/19857399/securities-and-exchange-commission-v-ripple-labs-inc/?filed_after=&filed_before=&entry_gte=&entry_lte=&order_by=desc#entry-974)  Edit: Ripple and the SEC have 60 days to file any appeals",681,2024-08-07 20:11:06,321
XRP,cryptocurrency,R.I.P Ripple,,4174,2020-12-26 00:05:22,584
XRP,cryptocurrency,"After losing several discovery disputes against ripple, the SEC warns the Court that if it loses the case it will cause irreparable damage to the SEC related to future enforcement actions in the cryptocurrency space and the Court should consider such consequences before ruling.","This is it for any doubters out there. For all the anti ripple people. The sec is using ripple to come after crypto. They literally told the court that the ripple case will cause so much damage to them they will not be able to enforce cases. Just remember the sec never gave Eth and btc clearance. They were only opinions from Jay Clayton and Bill Hinman. They will come after miners, vitalik....everyone.",2440,2021-06-08 22:24:43,726
XRP,cryptocurrency,"MicroStrategy's Saylor Urges the SEC to Shut Down Ripple, Says ETH and XRP Are Unregistered Securities",,1119,2022-12-06 18:06:57,1086
XRP,cryptocurrency,Stephen Colbert announces that Ripple donated $27 million in XRP to DonorsChoose.org,,4035,2018-03-28 04:28:59,984
XRP,cryptocurrency,Ripple Co-Founder Endorses Kamala Harris for US President,,367,2024-09-06 11:44:38,367
XRP,cryptocurrency,Kamala Harris Meets with Ripple and Coinbase on Cryptocurrencies,Vice President Kamala Harris's election campaign advisors have reportedly contacted key names in the cryptocurrency industry. These contacts are part of an effort to develop relationships that could inform the future regulatory framework.,514,2024-07-29 16:50:07,282
XRP,cryptocurrency,Ripple co-founder says Kamala Harris will take a 'completely different approach' to Biden's war on crypto,,245,2024-10-29 12:52:59,266
XRP,cryptocurrency,Summary Judgement is Here for the Ripple Case,,715,2023-07-13 15:40:31,593
XRP,cryptocurrency,Ripple Backs The SEC Into A Corner Over Ether’s Securities Status,,1543,2021-09-04 00:11:47,526
XRP,cryptocurrency,Vitalik Buterin Takes Aim At Ripple (XRP): 'They Tried To Throw Us Under The Bus',,1179,2022-08-18 11:00:55,417
XRP,cryptocurrency,Ripple CEO predicts crypto market will double in size to $5 trillion by the end of 2024,"Ripple CEO predicts crypto market will double in size to $5 trillion by the end of 2024  &#x200B;  * **Ripple CEO Brad Garlinghouse said he expects the entire value of the crypto market to double this year, citing the arrival of the first U.S. spot bitcoin exchange-traded fund and upcoming so-called bitcoin “halving.”** * **“The overall market cap of the crypto industry ... is easily predicted to to double by the end of this year ... \[as it’s\] impacted by all of these macro factors,” Garlinghouse said.** * **One of the other factors Garlinghouse sees pushing the crypto market to new highs is the possibility of positive regulatory momentum in the United States.**  [**https://www.cnbc.com/2024/04/08/ripple-ceo-crypto-market-to-double-in-size-to-5-trillion-in-2024.html**](https://www.cnbc.com/2024/04/08/ripple-ceo-crypto-market-to-double-in-size-to-5-trillion-in-2024.html)  1 one tip to just buy and hold :)",681,2024-04-08 14:35:58,200
XRP,cryptocurrency,"Ripple co-founder and former CTO, Jed McCaleb, is running out of XRP to dump in the market. Currently has only 114 Million XRP Left.","Jed McCaleb initially has eight billion XRP given to him for his initial work with a past project that is now named Ripple. He left Ripple to work on Stellar (XLM) in 2014, and ever since he has been dumping his XRP tokens in the market, but now he is almost running out!  According to data provided by [Jed Balance](https://jed.tequ.dev/), which is a site dedicated to tracking Jed's XRP holdings, he now only have about 111 million XRP left in his name (or this particular wallet/account).   &#x200B;  https://preview.redd.it/v0o57nzej1891.png?width=1767&format=png&auto=webp&s=957f41819aa15b8b2979537ef0012ffc688c5aec  He has been dumping about 4 million XRP tokens per day this month, going at this phase we might see him run out of xrp in a single month, of a few months time if he changes how much he sells everyday. OR he might altogether just stop selling again like what he did around 2021.",1120,2022-06-26 22:24:59,475
XRP,cryptocurrency,"Gary Gensler’s ‘reign of terror on crypto’ will soon end, says Ripple CEO",,511,2024-10-26 18:46:52,111
XRP,cryptocurrency,"Cardano Founder, Ripple CTO Reveal Details For A Possible Partnership","Charles Hoskinson, the founder of Cardano, and David Schwartz, the Chief Technology Officer of Ripple, have unveiled details about a potential collaboration between their respective blockchain platforms. The partnership aims to integrate Cardano’s advanced decentralized finance (DeFi) capabilities with Ripple’s extensive liquidity network, potentially bridging two of the industry’s most prominent ecosystems.",420,2024-11-19 20:27:40,116
XRP,cryptocurrency,XRP got much more love than they deserve - Ripple is heavily centralized and fights real decentralization in the crypto space,"During the SEC lawsuit, I have noticed XRP getting a lot of love from the crypto community, and I can understand this. The SEC was never only going against Ripple as we have seen this year, so this entire lawsuit was somehow representative for all of crypto.  However now that things are somehow settled, we should face reality: XRP is just another heavily centralized project, no matter if it's a security or not. The consensus mechanism is literally proof of trust - The network runs on a bunch of bank owned servers, relying on all participants being doxxed. This is not innovative blockchain tech, this is the same old banking system using ""blockchain"" as a marketing term.  I could live with that alone or ignore it at least - XRP it's by far not the only centralized cryptocurrency. However Ripple has also done their best in the past to fight real decentralized cryptos like BTC and ETH:  They often attack BTC, for example Ripple CFO claimed BTC is controlled by China in 2020 ([source](https://gizmodo.com/ripple-claims-bitcoin-is-chinese-controlled-while-annou-1845932148)). The same claims were made against Ethereum according to Vitalik Buterin ([source](https://zycrypto.com/vitalik-buterin-faults-ripples-decentralization-claim-says-the-platform-is-completely-centralized/)), for which they never apologized.  Also most of you probably remember they funded a FUD energy campaign that tried to push Bitcoin towards PoS ([source](https://decrypt.co/96298/ripple-co-founder-backs-controversial-campaign-change-bitcoin-code)).  &#x200B;  At this point people should really think twice if that's a project they want to support just because there is some bullish outlook after they won the case. Ripple is not using, but abusing ""blockchain"" - and they are certainly not your friends.",529,2023-08-01 12:13:25,502
XRP,cryptocurrency,The Gloves Are Off. Ripple laying into J.P Morgan As They Enter The Crypto Space.,,2095,2019-02-15 15:16:25,529
XRP,cryptocurrency,US judge denies SEC's attempt to appeal Ripple ruling.,,630,2023-10-05 14:57:00,265
XRP,cryptocurrency,Happening Now: Visa Has Acquired Ripple Partner CurrencyCloud for $925 Million,,1012,2021-12-22 23:59:59,479
XRP,cryptocurrency,"Ripple CEO Brad Garlinghouse: SEC 'Weaponized the Lack of Regulatory Clarity,' Threw 'an Entire Industry Into Chaos'",,993,2023-06-16 10:24:17,181
XRP,cryptocurrency,The SEC is trying to block a motion from Ripple lawyers that could expose whether SEC employees traded or invested in XRP,,1508,2021-09-06 11:48:37,267
XRP,cryptocurrency,Ripple co-founder donates $1 million XRP to Kamala Harris campaign PAC,,292,2024-10-11 20:21:32,131
XRP,cryptocurrency,The SEC has been ordered by the court twice to hand over documents regarding bitcoin and eth and ripple still have not received a single document. Ripples fair notice defence effects all US crypto.,"Basically the sec is now stalling. It’s becoming very apparent Jay Clayton went ahead with this lawsuit prematurely and without concluding an investigation. The guy literally did it on his last day.  The court has ordered the SEC to hand over documents regarding Eth and BTC twice and they still haven’t done it. The sec is starting to look like a complete embarrassment. But ripples fair notice defence is where they can win at summary judgment.   The sec had 8 years to bring the case forward. They had 8 years to help crypto but instead Jay Clayton filed the lawsuit on the last day. Ripple are now saying they did not have fair notice. The SEC sat on their hands and didn’t assist crypto in anyway. If ripple win the fair notice defence that means the SEC cannot go after the OG cryptos. They fucked up, by sitting aside and doing nothing they have essentially dug their own grave.",1347,2021-06-05 03:12:35,333
XRP,cryptocurrency,Ripple CEO Brad Garlinghouse Says Company Will Leave US if SEC Wins Lawsuit: Report - The Daily Hodl,,812,2022-06-28 01:44:36,421
XRP,cryptocurrency,Ripple's XRP (xRapid) Now Live and Commercially Available,,1236,2018-10-01 20:03:08,862
XRP,cryptocurrency,"Ellen has almost 80 millions followers and she shilling ripple, xrp.",,1386,2018-05-23 07:54:57,708
XRP,cryptocurrency,Ripple’s RLUSD Stablecoin Wins Approval From NYDFS,,295,2024-12-10 20:38:41,89
XRP,cryptocurrency,SEC Targets Ripple Labs: Staggering $2 Billion Fine Looms,,405,2024-03-26 06:52:11,197
XRP,cryptocurrency,"Experts say Ripple will win SEC lawsuit, which might propel XRP to new all-time highs",,838,2021-09-17 08:53:44,504
XRP,cryptocurrency,A simple diagram showing how Ripple the private company has made billions of USD in last 7-8 years,,1500,2019-08-23 06:29:22,397
