Crypto,Subreddit,Title,Content,Score,Created_At,Comments
XRP,cryptocurrency,"Vitalik Buterin says XRP is ‘completely centralized,’ Ripple CTO reacts",,522,2022-12-20 16:38:42,441
XRP,cryptocurrency,"You can buy Bitcoin, Bitcoin Cash, Ethereum, Litecoin, IOTA, Ripple, Dash and Komodo in cash at 400 Austrian Post Office branches",,2414,2018-06-25 14:27:14,239
XRP,cryptocurrency,Ripple's Price Explodes Above $0.7 as XRP Bull Run Takes Off,,126,2024-11-12 21:41:30,118
XRP,cryptocurrency,Ripple (XPR) is bad for the crypto community and the whole world.,"The main idea that Ripple sells is to upgrade current bank transfers from 40-year-old technology to modern blockchain technologies that will allow money to be transferred in seconds instead of days.  Ripple Labs and its founders initially owned all the XRP coins, which they gradually sell to all participants (mostly banks) so that they can fully use their technologies.  Even though you can theoretically run your own validator, it doesn't make much sense unless Ripple Labs approves it. Otherwise, you will not be included in anyone's list of trusted validators and no one will take you seriously.  It turns out that Ripple Labs is essentially the central bank of this system. And XRP is its CBDC.  Ripple aims not to change the current fiat system, but, on the contrary, to sustain its existence. Ripple is the evil twin of Bitcoin. And if you hope to someday see a world where money is not controlled by the state, which constantly devalues it through inflation, you will be against Ripple.",172,2023-07-15 12:53:03,573
XRP,cryptocurrency,"Bitcoin, Ethereum, Ripple price surge as cryptocurrency ban dismissed by European Central Bank",,2006,2018-02-14 11:52:05,226
XRP,cryptocurrency,"Ripple's CEO will join Coinbase's President on the first ever CNBC Fast Money ""Goes Crypto"" - Tuesday, 5:00PM ET",,1268,2018-03-03 22:51:13,398
XRP,cryptocurrency,Court victory for Ripple as judge denies SEC motion to seal Hinman docs,,498,2023-05-16 22:51:16,216
XRP,cryptocurrency,World Economic Forum Confirms Ripple As An Official Partner,"Reports came out yesterday, August 24th, 2022 that the WEF official website is listing Ripple as an official partner of the organization.   “Ripple is dedicated to creating powerful gains in financial efficiency, equity, and inclusion.“  WEF further states:  “Ripple is developing and enabling future use cases that will catalyze the new digital economy for governments, businesses, and consumers.”  Not only is Ripple displayed on the WEF website, but they are also officially on the partners list.   This does not come as a surprise because Ripple CEO Brad Garlinghouse spoke at the WEF 2022 panel discussion held in Switzerland.  Nothing but shocking developments coming from the Ripple team and the XRP ecosystem.  Written by calex960 on thexrpdaily",419,2022-08-26 09:18:36,439
XRP,cryptocurrency,Hackers steal $112 million of XRP Ripple cryptocurrency,,467,2024-02-01 20:57:35,126
XRP,cryptocurrency,"“Purchasing XRP is not an ‘investment’ in Ripple; there is no common enterprise between Ripple and XRP purchasers; there was no promise that Ripple would help generate profits for XRP holders...” - Ripple Inc in Reply to Suit File Against it for Security Fraud, 20 Sept 2019",,889,2019-09-20 10:19:00,450
XRP,cryptocurrency,Cardano (ADA) Overtakes Ripple (XRP) to Become Fourth Largest Crypto,,873,2021-02-10 08:47:48,296
XRP,cryptocurrency,"Ripple has grown by an amazing 22,000%",,932,2017-12-28 15:40:06,562
XRP,cryptocurrency,Ripple USD stablecoin set for trading debut tomorrow,,184,2024-12-16 16:23:50,63
XRP,cryptocurrency,"Ripple has spent ‘over $100 million on legal fees fighting SEC’, the CEO says",,547,2022-07-17 18:57:39,265
XRP,cryptocurrency,Ripple CEO Unveils Key Date: What XRP Holders Need to Know - Wall Street Pit,,46,2024-12-07 00:32:07,95
XRP,cryptocurrency,63% of the Ripple (XRP) community has gone for good,,644,2020-04-22 16:44:07,453
XRP,cryptocurrency,"Germany's Second Biggest Stock Exchange Launches Crypto Trading of Bitcoin, Ethereum, Litecoin and Ripple",,2112,2018-05-16 20:42:19,145
XRP,cryptocurrency,The SEC’s Window to File an Appeal in the Ripple Case has Officially Closed For Years,"I think everyone here saw the news that the SEC was planning to appeal the summary judgement ruling handed down from Judge Torres on Friday. The whole thing started when the SEC filed documents in the Do Kwon case that read as below:  “The SEC respectfully avers that Ripple conflicts with and adds baseless requirements to Howey and it’s progeny. Respectfully, those portions of Ripple were wrongfully decided, and the court should not follow them.”  I mean what else are they gonna say? Of course they disagree with the ruling. But, as many pro-crypto lawyers have pointed out, if the SEC loses an appeal then it becomes binding case law for trial judges. This would be disastrous for their plans to bring the crypto market into “compliance”.   Anyhow, The SEC had until midnight to file an interlocutory appeal. An interlocutory appeal is basically an appeal before final judgment on some aspects of the ruling. They’re rarely filed and even more rarely accepted.  They didn’t file one, which means they must wait until final judgment from the jury trial to file an appeal unless there is a settlement. Ripple’s CEO has said that the trial could take years.   TL;DR  The SEC’s window to file an interlocutory appeal in the Ripple case has ended. They must now wait until the jury trial is finished to file an appeal which could take years according to Ripple’s CEO.   Sources:  [SEC only has 10 days to file an appeal](https://www.newsbtc.com/news/ripple/ripple-sec-xrp-investors-need-to-know-deadline/)  [Ripple CEO says an appeal could take years](https://unchainedcrypto.com/sec-appeal-could-take-years-says-ripple-ceo/)",316,2023-07-25 04:52:31,202
XRP,cryptocurrency,"Cardano CEO says Ripple v. SEC case might be settled by Dec. 15, warns of 'catastrophic' impact",,261,2022-12-12 06:58:10,365
XRP,cryptocurrency,"Reminder: Ripple XRP is centralized, and they can freeze any user's funds, especially when asked by the government.",,1522,2017-12-30 03:49:42,195
XRP,cryptocurrency,Ripple CEO Claims Trump's Election Unlocked $800 Billion in US Crypto Industry,,199,2024-11-16 12:14:25,55
XRP,cryptocurrency,Ripple cryptocurrency (XRP) jumps after company to win against SEC for its security status,,107,2024-10-21 07:57:43,81
XRP,cryptocurrency,"Bitcoin drops to 1-week low, ether slides 7% as FTX collapse ripples through crypto market",,402,2022-11-21 09:29:17,214
XRP,cryptocurrency,"“Ripple is highly centralized & XRP is more akin to a PayPal account than a trustless system like bitcoin.... It's hard to come up w any rational reason why XRP exists in the Ripple protocol, other than as a means for Ripple to make money. Lots of money.“",,1061,2018-01-04 21:06:02,266
XRP,cryptocurrency,Judge rules Terra ‘stablecoin’ and other tokens are securities in victory for the SEC and departure from Ripple case,,204,2023-12-29 13:35:07,164
XRP,cryptocurrency,"Wells Fargo Fined for $3.7B But the World is Still Fixated on FTX Collapse, Ripple CEO Chips In",,617,2022-12-22 21:36:25,136
XRP,cryptocurrency,"US 'the only country' crypto startups should avoid, says Ripple CEO",,216,2023-09-13 06:01:44,195
XRP,cryptocurrency,"The SEC is going after Coinbase now. First it was Ripple and all of us laughed. Now it is Coinbase, Next it could be us.","The SEC is suing Coinbase over its Lend product that pays out interest to asset holders. This is appalling, because it is something that the banks that the SEC protects will never be able to do - give actual returns to user’s assets, not the 0.05% interest pittance that is dished out to users by banks.   Somehow, the big brains at SEC, well funded by tax payers, have now come up with legal arguments as to why giving retail end users a decent interest rate is a crime and securities fraud. 🤯  The regulators never act in the interest of retail users, mom and pop investors and regular folk. They simply exist to protect the rights of the banking and securities cartel. There never was any investigation into dark pools, naked shorts by hedge funds, trading restrictions and manipulation by the big players. Instead, the SEC even made rules that now prevent retail from buying shares in companies they own. Basically legitimising Robinhood’s tactics.   Even right now, there are more GME shares held by institutions than the total shares outstanding. So many counterfeit shares. Over the last week, shares of defunct companies like Blockbuster and Sears have surged 1000%... these are companies that are already bankrupt and in liquidation, but somehow a well regulated SEC monitored market still allows Blockbuster to rise 1500%.  The SEC is utterly incompetent and exists only to harass retail and prevent small time investors from making it big  Coinbase CEO Brain Armstrong put out a message just now :   “Some really sketchy behavior coming out of the SEC recently. Story time…Millions of crypto holders have been earning yield on their assets over the last few years. It makes sense, if you want to lend out your funds, you can earn a return. Everyone seems happy. A bunch of great companies in crypto have been offering versions of this for years. Coinbase came out recently and said we would be launching our own version....  They responded by telling us this lend feature is a security. Ok - seems strange, how can lending be a security? So we ask the SEC to help us understand and share their view. We always make an effort to work proactively with regulators, and keep an open mind.”  Tl DR: the SEC refused to meet either Coinbase, saying they don’t meet crypto companies. But prefer regulation by litigation approach.   These are not the actions of an regulatory agent acting in good faith.",575,2021-09-08 04:02:05,233
XRP,cryptocurrency,XRP Surges As Ripple Aims For “Very Big Win” Against SEC In Latest Filing,,425,2022-09-18 17:47:58,201
XRP,cryptocurrency,Ripple (XRP) has no plans to settle SEC lawsuit. It's prepared to go to trial,,518,2021-09-22 04:50:16,232
XRP,cryptocurrency,Former U.S. CFTC chair believes that the new U.S. SEC chair might drop the Ripple case,,169,2024-11-29 07:04:06,44
XRP,cryptocurrency,Update in the SEC vs ripple labs case. The SEC is refusing to hand over documents in regards to their internal trading policies. Even after being ordered by the judge….twice.,"What you are seeing here is elite corruption at its highest level. The SEC is refusing to hand over internal trading policies in regards to staff and their holdings of securities.  Basically the SEC allowed staff to own Xrp up until 2018/2019. They emailed 3rd party investors (you and me) in late 2020 and stated they had not made a determination on Xrp’s security status.  Yet they are suing ripple, Brad and Chris for breaking securities laws from……2013. There is a hearing coming up in regards to these documents…..again.   The SEC is nothing but a gangster organisation who litigate for fines which is their source of revenue. The Ripple lawsuit has given the public a look behind closed doors to see how utterly corrupt they are.  Like Elon said on 60 mins  “I have no respect for the SEC”",645,2021-08-28 05:41:15,180
XRP,cryptocurrency,‘Entire Crypto Industry Goes Parabolic’ If Ripple Takes Win Over SEC In XRP Lawsuit: Pundit,,261,2022-09-22 18:03:39,255
XRP,cryptocurrency,"Ripple’s XRP soars 30% - why you should be supporting Ripple, regardless of your opinion on XRP","I’m sure most of you here have seen XRP’s staggering performance today. The reason for this post is because most people on this sub dislike XRP due to its centralised nature. However, the following reason - in my opinion - is why everyone should be cheering for Ripple in the ongoing lawsuit, no matter your opinion on XRP.  Let’s face it, XRP holders have had a rough few years after the lawsuit was announced in December 2020. However, as the years have gone on, we have seen countless amazing projects enter and drop out of the top 10 - Chainlink, Monero, Tezos - to name a few. Guess which coin has amazingly retained its top 10 spot, despite having the SEC on its back? You guessed it: XRP.  Regardless of whether you hold, love or hate XRP, Ripple are doing what pretty much all of us would love to do, and that’s give a huge middle finger to the SEC. One must realise that an SEC victory will put so many other projects under scrutiny, and this will not favour crypto well as a whole. We will witness many of our favourite projects being placed under the microscope of the regulators. However, if the lawsuit ends with a Ripple victory, it may potentially set up crypto for a (mini) bull run, as regulators are forced to lay off as we see some sort of regulatory clarity in our beloved industry. The crypto industry as a whole is likely to piggy-back off the success of the lawsuit, should we see a favourable victory. No one wants to be in Ripple’s position, but I’m sure we can all appreciate that Ripple has taken one for the team and is fighting one of the most important battles - not just for themselves, but for the entire crypto industry.  Tldr: FUCK THE SEC",122,2023-03-21 21:26:02,305
XRP,cryptocurrency,JP Morgan Might Have Just Killed The Ripple XRP Dream,,494,2019-02-14 19:17:57,420
XRP,cryptocurrency,Ripple CEO claims the SEC is a bully ‘trying to regulate through enforcement’,,406,2022-09-26 18:24:08,166
XRP,cryptocurrency,Happens not only to noobs: Former Ripple CTO has lost his password to a $231 million Bitcoin fortune,,682,2021-01-12 15:52:28,184
XRP,cryptocurrency,"Ripple CEO expects US to turn more crypto-friendly after election, no matter who takes the Oval",,193,2024-10-24 21:13:09,42
XRP,cryptocurrency,SEC Will Appeal XRP Ruling in Case Against Ripple,,98,2023-08-11 11:49:40,234
XRP,cryptocurrency,"XRP news abound this week! Former Ripple chair Barr Confirmed as new Fed Chief, Judge Netburn named the SEC 'hypocrites' in ruling, McCaleb (XLM) dumping nearly done. Whew!","My goodness friends, what a week for Ripple. XRP holders, catalysts abound yet we remain stuck in by the bears. Let's do a quick recap anyway, and hope that the market begins to reflect the bullish news:  Michael Barr Confirmed: Michael Barr, a former Ripple adviser, is set to assume one of the most important U.S. regulatory roles after winning Senate confirmation to be vice chairman for supervision at the Federal Reserve. Barr is considered an ally to crypto, but has tempered his sentiments with expectations that the market be regulated robustly. This appointment is widely considered good for crypto, and considering it's issues with the SEC - good for Ripple.  Netburn says 'the Hinman emails must be produced': The long awaited ruling has finally come down from Magistrate Judge Sarah Netburn regarding the attorney-client privilege of conversations had with SEC lawyers by William Hinman. Judge Netburn unequivocally ruled in favor of Ripple, even slamming the 'hypocrisy' of the SEC in its attempted defense - asserting that the SEC isn't even attempting to follow the law in good faith. In his now infamous speech Hinman said that Bitcoin and Ethereum were not to be considered securities, despite ETH having conducted the same kind of unregistered token offerings as Ripple. The preperatory emails Hinman exchanged with SEC lawyers have been desperately guarded to this point, and it remains to be seen what the SEC will do. It seems likely that there will be a series of appeals to Judge Analise Torres, who is responsible for ruling on any appeals to Judge Netburn's decisions.  Jed's dead baby: Former Ripple CTO Jed McCaleb is almost done selling his 9 billion XRP after nearly 8 years. Jed left Ripple after having differences with the leadership team on the direction of the project there. Jed has since worked to bring Stellar (XLM) into the crypto space as a competitor to Ripple within the global payment settlement industry. It is believed that Jed has nearly completed selling his stack of XRP, (he holds approximately 10 million in his TacoStand account) which is estimated to be gone by weeks end. XRP fans are ecstatic about this, as the downward selling pressure has been significant from McCaleb for nearly a decade.  Other notes: Did you know that Ripple only controls about 5% of nodes on the XRPL? XRP is more decentralized than many crypto projects. The community drives most innovations on chain as well, and will soon deliver Smart Contracts to XRPL in a 100% community driven effort, minus any Ripple devs. Congrats!  Much to be excited for if you hold a bag of XRP. Thanks for reading!",319,2022-07-14 12:37:42,223
XRP,cryptocurrency,"Ripple Closer to Victory, Court Orders SEC Over ""Hinman"" Documents",,224,2022-10-21 00:23:43,247
XRP,cryptocurrency,‘Immense Potential’—Ripple Braced For XRP Spot ETF To Rival Bitcoin And Ethereum,,114,2024-12-04 19:30:20,41
XRP,cryptocurrency,SEC Appeals Verdict in Ripple Securities Case,,54,2024-10-02 21:11:32,71
XRP,cryptocurrency,Ripple slips below $2,,619,2018-01-10 00:42:05,324
XRP,cryptocurrency,Judge Torres has Denied Motion to File an Interlocutory Appeal in the Ripple case,,169,2023-10-03 23:25:59,152
XRP,cryptocurrency,New York crypto regulator removes Ripple and Dogecoin from token 'greenlist' in latest update,,119,2023-09-19 05:07:43,183
XRP,cryptocurrency,Only 10% of Ripple held by masses,,703,2018-01-20 14:14:00,267
XRP,cryptocurrency,Ripple lawyer accuses SEC of intentional delay lawsuit,"One of the top lawyers in the Ripple (XRP) camp, Stuart Alderoty, recently lashed out at the US Securities and Exchange Commission (SEC) on Twitter. According to Alderoty, the SEC would deliberately try to delay the lawsuit between themselves and Ripple as long as possible.  &#x200B;  **Ripple lawsuit**  Ripple, meanwhile, has been embroiled in an infamous lawsuit with the US SEC for over a year. The SEC accuses Ripple of selling securities in the past without the necessary licenses. At the moment, Ripple is hopeful that the lawsuit will soon come to an end and the judge will finally issue a ruling. However, Alderoty lashed out at the SEC on Twitter. He believes that the SEC does not want the court case to end any time soon.  &#x200B;  https://preview.redd.it/jisowqdswhb81.png?width=498&format=png&auto=webp&s=4e9c680ce369d60ff1003268f0fa06d86912468a  **Gary Gensler**  In the series of Twitter messages, Alderoty responds to a message from SEC Chairman Gary Gensler. Gensler revealed why, in his opinion, enforcement of rules is one of the SEC's most important tasks. Soccer without referees would turn into an unfair occupation in no time according to Gensler. If teams don't have to worry about penalties and enforcement of the rules, things will go wrong. The same goes for the markets, according to Gensler.   &#x200B;  https://preview.redd.it/dmwxeixuwhb81.png?width=509&format=png&auto=webp&s=0ef5caa037c3fe6e1f067f0eed849ae04b274c14  Alderoty argues that the SEC is guilty of ""regulation by enforcement."" That by simply initiating a lawsuit against an entity they are trying to control certain markets. This is also why, according to Alderoty, the SEC does not seem to be in any particular hurry in the lawsuit.  &#x200B;  Ripple's CEO, Brad Garlinghouse, still seemed convinced in November of last year that the lawsuit will end this year. In addition, he is hopeful that the judge's ruling will also be in Ripple's favor.",346,2022-01-13 18:08:40,228
XRP,cryptocurrency,Ripple loses patience and wants court to sanction SEC,,531,2022-03-26 03:31:10,138
XRP,cryptocurrency,Bloomberg - Banks do not want to use XRP from Ripple,,605,2018-01-25 23:51:36,298
XRP,cryptocurrency,"Ripple, the firm behind cryptocurrency XRP, just added 2 more financial services firms to its roster of clients",,478,2018-01-24 14:33:01,395
XRP,cryptocurrency,Ripple’s CEO accuses the SEC of operating above the law,,277,2024-10-14 05:51:59,25
XRP,cryptocurrency,Ripple hits $1,"Not a fan.....at all.  However grats to all those who made profits. I never would have thought they would be able to accomplish the dollar mark, let alone in 2017.  Where will this lead us coming into the new year? Is Ripple still a trusted structure?  The market is a growin!  640 billion and no signs of slowing down.",556,2017-12-21 06:02:50,308
XRP,cryptocurrency,"My efforts for mass adoption: I'm building a crypto to fiat point of sale app and payment platform. Supporting Nano, Stellar Lumens and Ripple payments to USD and AUD (initially). Your feedback is greatly appreciated.","I very much believe that cryptocurrencies will be adopted by the masses in the future however I also believe that a series of gradual transitions need to occur rather than a mass takeover. The majority of merchants are simply not ready or willing to accept cryptocurrencies as a form of payment. There are several reasons for this including obvious volatility issues, difficulty in liquidating crypto assets, ongoing changes to regulation, taxation issues and the general negative or uninformed perception of cryptocurrencies.   In an ideal world we as consumers should be able to choose which currencies we trade with, while merchants should be able to receive the currencies that work for their businesses. The platform I’m building caters for currency agnostic transactions for point of sale using mobile apps (web based crypto-fiat payments will follow soon after). I believe this interim approach leads to several benefits:   *	Consumers can spend their crypto immediately without having to convert to fiat first. There are potential tax implications here.  *	Merchants don’t need to worry about volatility, however they can still accept cryptocurrencies for the benefit of their customers.  *	There are no fees to be paid by merchants for payment processing.  *	Rewards (Liquidium Tokens) will be given to both merchants and consumers for using the services. This will incentivize both parties to spend crypto as spending leads to the earning of tokens.  *	Anybody with a bank account can be a merchant. This is to be used by individuals and businesses to facilitate crypto to fiat payments.  So far the platform can accept Nano, Ripple, Stellar Lumens and soon, Liquidium (LQM). Liquidium is a token based on the Stellar network. These tokens will be used for transactions and rewards and since it’s based on Stellar, all transactions are quick to settle.   I understand there are many projects focusing on crypto payments but it seems like most projects that started as ICOs are focusing on pushing their own token / coin rather than enabling crypto payments for all cryptocurrencies suitable for cheap and timely transactions.   To prove I’m not full of shit, [here is a brief demo of the app](https://youtu.be/Ft6ku1s8sTg) actually working (functionality and design subject to change between now and the release). We currently have a few businesses testing the system in the real world. Open beta testing invites will take place soon.  Any input is much appreciated. This will be released soon and I'd like to appeal to as wide an audience as possible.  I have set up a subreddit [/r/liquidium](https://np.reddit.com/r/liquidium) if you’d like to keep track of the project or ask questions. We’ll be looking for early adopters in the near future.  Edit: formatting",933,2018-03-11 11:18:18,167
XRP,cryptocurrency,Ripple CEO Unveils Stablecoin Plans and XRPLedger Insights at Paris Blockchain Week,,80,2024-04-11 17:46:00,106
XRP,cryptocurrency,Ripple Co-founder Jed McCaleb Sold 54 Million XRP in April,,483,2020-05-04 08:51:35,231
XRP,cryptocurrency,Ripple lands largest Middle East client in UAE Exchange,,567,2018-02-12 11:23:54,275
XRP,cryptocurrency,Ripple's XRP sees over $4 billion in profit-taking following surge in whale activity,,218,2024-12-04 04:38:13,19
XRP,cryptocurrency,"San Francisco Lost Its Chance to Be Blockchain Capital, Ripple’s Larsen Says",,81,2023-09-06 12:52:31,170
XRP,cryptocurrency,SEC officials under investigation for conflict of interest in Ripple lawsuit,,390,2021-08-19 14:43:39,188
XRP,cryptocurrency,"SEC Wants to ‘Remake the Law,’ Rather Than ‘Apply it,’ Says Ripple General Counsel",,457,2022-09-22 04:35:01,110
XRP,cryptocurrency,Ripple CEO endorses crypto lawyer in race against Sen. Warren,,65,2024-10-28 01:48:20,45
